content,asertividad,autoconciencia emocional,autoestima,desarrollar y estimular a los demás,empatía,autocontrol emocional,influencia,liderazgo,optimismo,relación social,colaboración y cooperación,comprensión organizativa,conciencia crítica,desarrollo de las relaciones,tolerancia a la frustración,comunicacion asertiva,manejo de conflictos,motivación de logro,percepción y comprensión emocional,violencia
No se preocupe don sebastián.el error fue de nosotros los chilenos al haberlo elegido.,0.37,0.64,0.89,0.42,0.42,0.48,0.57,0.45,0.5,0,0.45,0.18,0.17,0.19,0.29,0.28,0.65,0.46,0.67,0.54
tuyo. no me metas a tusaco ( de w),0.12,0.15,0.33,0.2,0.2,0,0.54,0.21,0,0.19,0,0,0.16,0.18,0.14,0.13,0.3,0,0.47,0.26
Me sumo. No soy cómplice de tener a este nefasto personaje.,0.25,0.33,0.54,0.64,0,0.33,0.39,0.46,0.34,0,0.31,0.19,0.18,0.39,0.15,0.29,0.33,0.23,0.17,0.54
LA MANGA DE CINICOS QLOOS ANDAN TODO EL DIA SIN MASCARILLA PERO COMO SALE PIÑERA SIN ELLA LOS FALITE DE MIIIERRDA SE ESPANTAN VAYANSE A LA CHU CHA DELINCUENTES QLOOOS,0.5,0,0.52,0.86,0.6,0.16,1.51,0.22,0.16,0.79,0.59,0.18,0,0.56,0.43,0.29,0.48,0.43,0.33,4.03
"Recuerda que la otra opción era guillie, siempre votamos por el mal menor.",0.14,0.18,0.19,0.24,0.42,0.18,0.85,0,0,0.42,0,0,0.58,0.2,0.31,0.32,0.34,0.23,0.35,0.64
"De los chilenos lesos que lo eligieron, no se esconda en la masa.",0.12,0.15,0.33,0.2,0,0.3,0.36,0,0.31,0,0,0,0.33,0.18,0.27,0,0.15,0.42,0.31,0.26
"El granuja, el pillo, el ladronzuelo, el especulador financiero, el peor de todos, el representante del 0.00000001 % hace lo quiere y cuando se le pare la R A J A luego se excusa, reconoce falsamente y aquí no ha pasado nada.",0.61,0,0.34,1.26,0.4,0.16,1.52,0.88,0.32,0.97,0.44,0.35,0.69,1.29,0.71,0.7,0.47,0.65,0.98,3.1
"Algunos de la muchedumbre que corrieron a saludarlo y pedirle fotos, dicen que lo reconocieron desde lejos por su ¨cabeza de ajo¨....",0.54,0.18,0.78,0.92,0.71,0.35,1.06,1.01,0.38,1.33,0.5,0.6,0.96,0.84,0.81,0.77,1.08,0.26,0.56,0.28
"Piñera cometio un error ahora, cometió un error cuando se fotografió en Plaza Italia, en otras palabras estamos gobernados por un tara...do!",0.76,0.33,0.71,1.54,0.81,0.51,1.58,1.59,0.81,1.2,1.05,1.27,1.08,0.94,0.58,0.74,1.13,1.53,0.5,0
"La otra vez comprandole copete ala vieja en cuarentena sin mascarillas,ahora en la playa sin mascarillas,eso se le olvida,pero para triangular con habitat,evadir pago de contribuciones,crear empresas falsas,criar hijos delincuentes,pucha que tiene memoria.",0.61,0.8,1.55,1.05,0.8,0.8,1.33,0.66,0.95,1.16,0.73,0.71,1.04,0.55,0.43,0,0.95,1.73,0.81,1.13
"pero siempre lo ha sido. y el 29% real que voto x el igual. menos mal que habemos un 71% normal, algunos flojos que no fueron a votar pero en fin, yo creo que aprendieron",0.74,0.64,0.87,1.06,0.6,0.81,1.54,1.34,0.64,0.59,0.44,0.36,1.22,0.37,1,0.57,1.11,0.87,0.82,0
Franco te manda saludos desde su vaticarro.,0.15,0.39,0.43,0.5,0.26,0.38,0.23,0.27,0.21,0.72,0.18,0.22,0,0.46,0.35,0.34,0.39,0.28,0.4,0.29
Bracitos cortos tiene tan poca inteligencia que es realmente difícil comprender cómo pudo amasar su fortuna.,0.26,0.67,0.93,0.88,1.35,0.67,0.6,0.24,0.53,0.42,0.79,0.57,0.73,0.6,0.15,0.44,0.68,0.73,0.88,0
"algunos chilenos pagan sus errores con cárcel, otros con clases de ética, Piñera no paga nada, y nunca ha pagado nada .... PINOCHEQUES se fue sin pagar, esperemos que Piñera por lo menos tenga por lo bajo una reclusión nocturna, o algo que nos haga pensar al común de los mortales que en Chile, la justicia también despertó, aún que sea ilusionarse mucho, no pierdo la fe.",1.28,1.98,1.85,1.98,2.98,2.27,3.63,1.08,1.58,2.47,1.43,1.73,3.14,1.08,2.09,1.33,1.85,2.15,2.23,1.58
"A hecho su fortuna usando información privilegiada,el no crea empleos como los Matte,Angelini,Luksic,Piñera es un especulador de la bolsa y tiene todo un séquito detrás pendiente de las acciones,jamas a sabido lo que es dar empleo y tener una empresa con trabajadores.",0.47,1.07,1.53,2.19,1.2,0.91,1.83,0.44,1.43,2.29,1.15,0.35,0.5,1.63,1.12,0.27,0.78,1.08,1.44,1.59
"Porque en Chile, desde la llegada de los españoles, el crimen de paga...y muy bien.",0.38,0.33,0.35,0.66,0.4,0.5,0.59,0,0,0.6,0.3,0,0.18,0.56,0,0.29,0.48,0.44,0.5,0.59
En buen chileno... choriando.,0,0,0,0,0,0,0,0,0.29,0,0,0,0,0,0,0,0,0.4,0,0
"Porque en Chile, desde la llegada de los españoles, el crimen paga...y muy bien.",0.25,0.17,0.35,0.44,0.41,0.51,0.59,0,0,0.4,0.3,0,0,0.38,0,0.3,0.49,0.44,0.5,0.59
"todos sabemos que el presidente se pasa por cierta parte todas las leyes ,total tiene un sequito de gente que sale a explicar lo inexplicable ,esto no es nada nuevo y seguro tampoco la ultima vez que se rie de lagente",0.24,1.27,1.89,1.46,1.39,0.8,2.27,1.1,0.79,0.78,0.44,0.7,1.21,0.55,1.42,0.42,1.42,0.43,1.79,1.69
"No sé de qué se extrañan. Soy Sebastián Piñera, dos veces Presidente de la República y multimillonario, con una fortuna de tres mil millones de doláres, ingeniero comercial de la Ponticuica y doctor en economía en Harvard, mientras ustedes, muertos de hambre, no tienen ni cómo llegar a fin de mes. En resumen: hago lo que me da la gana y qué.",1.27,1.5,1.66,2.73,1.95,1.19,3.4,2.34,1.09,2.62,1.41,0.85,2.28,2.12,1.78,1.31,2.28,1.9,1.26,1.57
Tal cual. Y sigue explotando a la clase media trabajadora.,0,0,0.33,0.59,0.2,0,0.36,0.21,0.16,0.19,0.14,0.34,0,0.18,0,0,0,0.84,0.31,0
Para que no sienta envidia intente lograr algo.,0.14,0,0,0.24,0,0.19,0.64,0.24,0,0.21,0,0,0.39,0,0.15,0,0.34,0,0,0.33
PERO EN BUENA LID Y CON BUENAS ARTES. COSAS QUE TU IDOLO NO CONOCE.,0.49,0.21,0.24,0.56,0.3,0.21,0.66,0.3,0.47,0.27,0,0.24,0.93,0,0.2,0.37,0.22,0.64,0.22,0.61
Multa pa ese aweo. nado,0.23,0.15,0.17,0.2,0,0.3,0.18,0.21,0,0,0,0,0.16,0,0.14,0,0.15,0,0,0.26
"Lamenta profundamente? Que mentira, si saben perfectamente que el plan este de esclavizar a la población privarla de libertades, es para los demás, no para ellos, eso está claro, y esto es una muestra de eso,",1,0.32,1.26,1.06,0.86,0.65,3.1,2.08,0.85,1.01,0.61,0.74,1.77,0.77,1.04,0.71,0.82,0.7,0.34,1.35
"Tanto escándalo por pasear por la playa sin mascarilla, lugar abierto, ventilado y a una hora casi sin personas....los adversarios ya molestan por molestar, es bullying....gente ociosa, ridícula.",0.78,0.68,1.26,1.59,0.82,1.04,2.03,0.92,0.33,2.03,0.61,0.55,0.18,0.77,0.74,0.76,0.82,0.44,0.85,1.53
Más ridículo es defender un desatino inaceptable. El presidente debe ser paradigma del ejemplo.,0.36,0,0.34,1.04,0.4,0.32,0.38,0.66,0.16,0.58,0.29,0.18,0,0.55,0.28,0.42,0.16,0.22,0.33,1.12
¿Puede ser más triste a estas alturas el espectáculo de este impresentable? Gracias a los ingenuos que votaron por él esperando que les diera “más trabajo”.,0.26,0.33,0.74,0.65,0.67,0.83,0.8,0.71,0,1.04,0,0,0.91,0.39,0.46,0,0.68,0.24,0.7,0.82
"algunos chilenos pagan sus errores con cárcel, otros con clases de ética, Piñera no paga nada, y nunca ha pagado nada .... PINOCHEQUES se fue sin pagar, esperemos que Piñera por lo menos tenga por lo bajo una reclusión nocturna, o algo que nos haga pensar al común de los mortales que en Chile, la justicia también despertó, aún que sea ilusionarse mucho, no pierdo la fe.",1.28,1.98,1.85,1.98,2.98,2.27,3.63,1.08,1.58,2.47,1.43,1.73,3.14,1.08,2.09,1.33,1.85,2.15,2.23,1.58
Perdon .......Solo fue a tomarse una fo to a plaza dig nidad............perdón fue a com prar un vi no a Vitacura en hora de to que de queda....perdon fue a una selfie a la playa..........excuse fue a comerse una pi zza a providencia.........mientras que maban el metro.........perdón,1.7,1.11,1.76,2.27,2.09,0.63,3.98,2.48,1.82,2.37,2.24,1.08,1.72,1.87,1.01,1.11,0.96,2.03,2.16,1.34
"con todo respeto, vaya a la..........",0,0.2,0.44,0,0.27,0.2,0.24,0,0.22,0.75,0,0,0,0.24,0.18,0,0,0.59,0.42,0
"La mascarilla sirve principalmente cuando se está en un recinto cerrado, rodeado de personas, donde todos comparten y respiran el mismo aire. PERO en un playa ABIERTA, con personas bien distantes de uno, y rodeado de aire puro y salino,...yo creo que el uso de la mascarilla es tontera.",1.49,1.13,2.33,2.74,1.5,1.93,2.71,0.92,1.53,1.62,1.22,1.1,1.41,1.53,1.33,1.7,1.48,1.39,1.19,0.81
ES EL CASO DE QUINTERO.,0,0.15,0.17,0.39,0,0,0.23,0.21,0,0,0,0.17,0.16,0.18,0.14,0.13,0.3,0,0.16,0
"...Claro que en el caso de Quintero, allí todos sus habitantes deberían usar SIEMPRE mascarillas (con el covid o sin el covid), ...pórque alli viven con las continuas e intoxicantes contaminaciones de las industrias alrededor.",0.35,0.77,0.84,1.2,1.18,1.07,1.28,0.86,0.78,0.76,0.43,0.34,1.33,1.08,0.69,0.4,1.7,0.85,0.96,0.81
"Cuando ha cumplido con las leyes y respetuso con las normas, entonces no nos entrañemos con lo que hace y sigue haciendo, ""Patrón de Fundo",0.35,0.6,0.66,0.59,0.78,0.45,1.61,0.43,0.78,0.19,0.42,0.17,1.3,0.18,0.69,0.52,0.76,0.63,0.79,0.79
"Con o sin cuarentenas todos podemos sacarnos la mascarilla en calles poco transitadas y ponérnosla cuando nos acerquemos a otras personas y eso se da mucho en mayores de edad que tienen más problemas para respirar, sobre todo en horas de mucho calor. No hay ninguna norma sanitaria que lo prohíba. Lo suyo es propio de zur dos contumaces y expertos en ASESINATO DE IMAGEN Y EN MENTIR, MENTIR....",1.66,0.77,2.39,2.61,2.02,1.53,3.32,1.32,1.44,1.92,1.31,1.57,2.52,1.09,1.27,1.48,1.56,2.4,2.1,3.71
"Aprovechan cualquier oportunidad para criticar a Piñera. No lo defiendo y tampoco es de mi agrado, pero quien se pone mascarilla para pasear por la playa ?",0.88,0.49,0.88,1.31,1.01,1,1.76,0.68,0.48,1.58,0.15,0.72,1.07,0.37,0.14,1.02,0.48,0.65,0.66,2.34
CARECE DE TODA SERIEDAD SU COMENTARIO EN BOLIVIA NO HAY PLAYAS .,0.23,0,0,0.2,0,0.15,0.93,0.43,0.31,0.19,0,0.17,0.16,0.18,0.14,0.26,0.3,0.21,0,2.1
"Estas equivocado, hay playas de ríos y también de estacionamiento.",0.12,0.3,0.17,0.39,0.59,0.6,0.9,0.43,0.31,0,0,0,0.16,0.35,0.55,0.13,0.3,0.21,0.31,0.52
y el Titicaca?,0,0,0.17,0.2,0.2,0.15,0,0,0.16,0.19,0,0,0,0,0,0.13,0,0.21,0,0
ERES TU NOHAYMAR,0,0,0,0.2,0.2,0,0.47,0,0.16,0.19,0,0,0.16,0.18,0.14,0,0,0,0.16,0
"el tema para la gente burra como tu es que se obliga a los 19 millones a no salir y usarla mientras que el presidente hace lo contrario, el tema son las señales que manda la autoridad, en este caso el presidente del pais, pero como es tan 4weonao , sabe que los 19 millones lo están mirando , de los cuales solo el 13 % lo defiende y sale igual en publico como no debe. Espérate que en una semana mas la gente común quiera ir a pasearse aun una paya, no te van a dejar pasar antes del peaje.",1.5,2.4,3.49,3.12,2.54,1.49,3.94,1.7,1.55,3.74,1.83,1.19,1.63,3.19,1.51,1.31,1.98,1.9,2.2,3.41
Si se mete al mar a para desgracia para nosotros los de derecha es que los tiburones no son coprófagos.,0.72,0.47,0.68,1.23,0.2,0.63,1.12,1.31,0.16,0.38,0.14,0,0.51,0.18,0.14,0.41,0.31,0.43,0.48,0.83
"A propósito de torniquetes, ¿cuántos se ha saltado este patán?",0.23,0.15,0.17,0.59,0,0.15,0.36,0.21,0,0.19,0.14,0.34,0.16,0.53,0,0.52,0.46,0,0.16,0.26
incontables,0,0,0,0,0,0,0,0,0,0,0,0,0,0,0,0,0,0,0,0
E INTOCABLES ENTRE BUEYES.,0,0,0,0.2,0.2,0.15,0.47,0,0.31,0.19,0,0.17,0,0.18,0,0,0,0,0.16,0
Da lo mismo ! Vengan a viña o Valpo todo el mundo sin mascarilla en la playa ! Puro show...,0.49,0.63,0.88,1.03,0.62,0.79,0.94,0.9,0.66,0.79,0.15,0.18,0.34,0.19,0.14,0.41,0.32,0.45,0.33,0.27
Ya pero será necesario que el show corra por cuenta del Presidente?...,0,0.6,0.5,0.98,0.2,0.45,1.25,0.21,0.16,0.37,0.28,0.51,0.65,0.18,0.27,0.13,0.61,0,0.79,0.52
algo verdadero que salga de un mentiroso.,0.3,0.19,0.21,0.5,0.26,0.19,0.23,0.27,0,0.48,0,0.44,0.21,0.46,0.18,0.34,0.59,0,0.4,0.29
Lo más patético de todo es que CNN CHILE corrió a entrevistar al alcalde Jadue para que suelte su estercolera.,0.39,0.34,1.07,0.45,0,0.69,1,0.69,0.81,0.4,0.15,0.37,0.55,0.57,0.29,0.15,0.65,0,0.17,1.21
"ES ALCALDESA JADUE, FUTURA PRESIDENTA DEL MOVILH.-",0,0.15,0.33,0,0,0.3,0.23,0,0.16,0.56,0,0,0,0.18,0,0,0.15,0.21,0.16,1.57
PERO SOMOS PUEBLO 80 &,0,0.15,0,0.2,0.2,0,0.23,0,0,0,0.14,0.17,0.16,0,0.14,0.26,0.15,0,0,0.52
"¿Y que dice la izquierda de los bailes nocturnos en Plaza Ñuñoa, de los vándalos ""manifestantes"" de la Plaza Baquedano?, ninguno con mascarilla.",0.46,0.6,0.66,0.78,1.17,1.19,1.43,0.43,0.78,0.56,0.28,0.68,0.98,0.18,0.55,0.39,0.61,1.06,0.79,1.05
LO TOMADO Y LO BAILADO NO SE LOS QUITA NADIE .SALUD.,0,0.17,0.54,0.23,0.21,0.18,0.8,0,0.33,0.2,0,0,0.19,0,0.15,0.15,0.17,0.22,0.17,1.24
"deja las drogas, PERDEDOR.",0.14,0,0,0,0,0.19,0,0,0,0.21,0,0,0.2,0,0,0,0,0,0,0.33
"muy bien lo que dice, pero dígale también a los del barrio alto, eventos en la explanada de las Condes. Ayer, después de haber bajado a fase 3, igual hicieron el evento, y viene otro mañana. Sin por ejemplo las normas mínimas de seguridad, vasos de vidrio, alcohol gel (del otro sobra), ni hablar de túneles sanitarios y el distanciamiento deja mucho que desear. Ojo, reitero, fase 3, no se pueden hacer estos eventos.",1.2,0.94,2.25,2.03,1.84,1.24,3.54,1.33,1.79,2.73,0.59,0.53,1.53,1.11,1.14,1.64,2.38,1.11,1.64,2.93
empate ¡¡,0,0,0,0,0,0,0,0,0,0,0,0,0,0,0,0,0,0,0,0
que defensa más mala del payaso,0.16,0.21,0.62,0.29,0.22,0.22,0.5,0.27,0.18,0.23,0.18,0,0.23,0.22,0.34,0.2,0.38,0.24,0.2,0.39
Rogelio.... hasta donde llega la estupidez de mezclar y comparar tu Payaso con los vandalos....? Buscate varas mas alta.,0.24,0.47,0.7,0.62,0.62,0.31,0.38,0,0.49,0.2,0.3,0.18,0.17,0.19,0.14,0.28,0,0.9,0,0.8
"pero igual Chile sigue siendio un pais mejor que el resto de latinoamerica, CHILENOS abran los ojos no destruyamos este pais y lleguemos a ser como Venezuela ... o chile en la epoca de Allende que vivi haciendo colas para poder comprar para comer ..",0.48,0.16,0.87,1.43,2.06,0.62,2.25,0.22,0.82,1.76,1.18,0.53,0.51,1.67,1.43,0.69,1.11,1.78,0.99,1.87
"Primero m presidente debe dar ejemplo, segundo no es santo como lo mencionas paulita.",0.35,0.15,0.33,0.39,0.2,0.15,0.36,0.43,0.31,0.19,0,0.17,0.33,0,0.27,0,0,0.21,0.31,0.79
no se puede defender lo indefendible,0.12,0.15,0.5,0.2,0.2,0,0.36,0.43,0.47,0,0.14,0,0,0,0.14,0.13,0.15,0.21,0.16,0
"ES UN SANTO ; QUE LASTIMA QUE SUSPENDIERON LAS PEREGRINACIONES ,HUBIESEMOS IDO A PRENDERLE UN VELITAS ........................................EN LA ....................R.A.J A..",0.6,0.31,1.02,0.2,0.79,0.16,1.21,1.31,1.1,0.77,0.58,0.52,0.68,0.72,0.42,0.27,0.47,0.43,0.48,1.65
QUIERES BAJARLE EL CALCHON A LA CHONG .,0,0,0.18,0.22,0,0,1.04,0.23,0,0,0.3,0.18,0.18,0.19,0.15,0,0.33,0.66,0,0.6
"Los izquierdistas que quemaron CHILE, y semanalmenteauspician la destrucción del centro de Santiago (apoyandocombatientes con ácido en las mochilas), ahora arman tremendo escándalo por una mascarilla... hace ratito que el sentido de las proporciones se perdió en este país.",0.52,0.51,0.89,1.8,1.43,1.03,3.02,0.69,0.32,1.81,0.76,0.18,1.1,0.95,1.18,0.76,1.8,0.22,0.85,2.42
COLO COLINO APENAS TE ALCANZA PARA UN EMPATE RATON.,0.26,0,0,0.65,0.44,0.17,0,0.71,0,0,0.31,0,0,0,0,0.15,0,0.48,0,1.09
"Entiendan LA MASCARILLA NO SIRVE DE NADANo existe una pandemia ,, solo show para vacunar a la mayor parte de la población ... Como tan ciegos",0.71,0.62,2.03,1.02,1.18,1.09,0.92,0.65,0.47,1.15,0.86,0.69,0.34,0.72,0.56,0.55,0.78,1.07,0.48,0.55
"no digas Burradas, seguro que a los medicos que trabajan en la Pandemia, les encanta andar forrados con mascaras y todo ese equipo coneste calor!!Como tanta ignorancia!!Han muerto mas de 20.000 chilenos!",0.24,0.92,1.18,0.6,0.2,0.31,1.65,0.22,0.47,0.57,0.29,0.17,0.83,0.54,0.56,0.13,0.62,0.21,0.96,1.35
todos mueren de Covid ahora......mal,0.16,0,0,0.29,0,0,0.25,0,0,0.23,0,0,0.23,0,0,0.2,0.19,0,0,0.39
Y con que vacuna Sra ???,0,0,0.33,0.2,0.2,0.3,0.36,0,0.16,0.19,0,0,0.49,0,0.14,0.13,0.46,0.21,0,0
Creo que no entiendes de qué se trata esta noticia...,0.23,0.15,0.5,0.39,0.2,0.15,0.9,0.43,0,0.19,0.28,0.17,0.49,0.35,0.27,0.39,0.61,0.21,0.16,0.26
"efectivamente, la mascarilla NO SIRVE PARA NADA",0.3,0.19,0.43,0,0.26,0.57,0.46,0.27,0.21,0.24,0,0,0.21,0,0,0.17,0.2,0,0.2,0
por favor explica tu teoria.,0,0,0.46,0.27,0.29,0.21,0.75,0.3,0.23,0.52,0.2,0.24,0,0,0.19,0.18,0,0.31,0.22,0
"Entiendo que que la gravedad es mayor cuando se trata de una autoridad, más aún si se trata del presidente de la República, pero como estamos en Chile y los jala bolas son timoratos de actuar pusilánime e interesados no cumplirán con su deber legal, moral y ético y se harán los larrys.",0.58,1.35,1.66,1.56,1.17,1.19,2.33,1.49,0.78,1.87,1.13,0.68,0.98,1.06,1.23,0.66,1.06,1.06,1.26,1.83
ENTRE LARRYS SE ENTIENDEN,0,0,0,0,0,0,0.23,0,0,0,0,0,0,0,0,0,0,0,0,0
el seremi cuida su peguita defendiendo a su jefe,0.28,0.18,0.61,0.24,0.25,0.18,0.44,0.52,0.39,0,0.34,0,0,0.43,0.17,0.32,0.56,0.27,0,0.57
AMBOS VALEN C.A.L.L.A.M.P.A .,0.28,0.18,0.4,0.23,0.48,0.36,0.56,0.51,0.58,0.45,0.17,0,0.2,0.21,0.16,0.16,0,1.05,0.57,0
y su abuela?,0,0,0.17,0.2,0.39,0.15,0,0,0.16,0.37,0,0,0,0,0,0.13,0,0.42,0,0
"igual que tu, Teillier, la Vallejo, la Tontiola y todos los gi.les del PC!!",0.12,0.3,0.83,0.2,0.2,0.45,0.54,0.43,0.16,0.56,0,0,0.16,0.35,0.55,0,0.3,0.21,0,0.52
"Que pobre y miserable que es Chile preocupado de que el presidente ande con o sin mascarilla, un 30% de la gente no paga el transantiago, hay pandemia, los parlamentarios no se han bajado el sueldo, salen elegidos con menos de 2%, hay ataques terroristas todos los viernes en Santiago y queman gente viva en el sur pero la noticia es que una persona anda sin mascarilla, claramente chile esta condenado por su gente, la raza es la mala.",1.53,2.15,3.75,3,2.41,1.99,4.22,1.75,2.08,3.07,1.16,1.4,2.84,2.18,1.55,1.34,2.65,2.61,2.26,2.38
"El presidente debe dar el ejemplo, por eso es grave que no cumpla las medidas sanitarias.",0.23,0.15,0.33,0,0.39,0.45,0.36,0,0.16,0.37,0,0,0.49,0,0.14,0.26,0.3,0.21,0.79,0.79
"Igual que los parlamentarios, ex presidentes y otros?, no es solo función del presidente dar el ejemplo, es de cada uno de ejercer su libertad de la manera que le plazca, creo que Chile es un pais hipócrita que siempre exige al resto lo que el no hace.",0.97,1.26,2.05,2.28,0.4,0.95,3.76,1.98,1.26,1.74,0.44,0.88,2.4,1.1,1.41,0.7,1.88,1.5,1.3,1.39
entonces como unos hacen el otro también... típico pensamiento mediocre... todo esta mal... y que el presidente que se “supone” representa al estado pa variar la kg a no es excusa... presidente de papel,0.24,0.16,1.54,0.62,0.79,1.26,1.5,0.66,0.47,0.77,0.29,0.35,1.37,0.73,0.71,0.55,0.78,0.64,1.29,1.39
NO POR ESO AL LADRON DEL BANCO DE TALCA HAY QUE ACEPTARLE TODO,0.37,0.32,0,0.42,0.4,0.16,0.99,0.44,0.48,0.39,0.15,0.18,0.87,0,0.28,0.28,0.16,0.43,0.16,1.69
"Tiene pruebas?, por favor deje de mentir o insultar sin pruebas, si las tiene vaya a la justicia y listo, el resto es solo envidia odio y mentira.",0.79,1.03,1.14,1.56,2.06,1.36,1.64,0.73,0.91,2.35,0.97,0.39,0.37,1.21,0.31,0.45,0.69,0.99,1.44,1.66
"LA IZQUIERDA CHILENA ES COMO EL DICHO ESPAÑOL; ""MAJO, SI ME E DE MORIR EN MADRID, QUE ME ENTIERREN EN SEVILLA""; ""SI ME DE MORIR EN SEVILLA, QUE ME ENTIERREN EN MADRID"". ESTO ES POR PURO ""JODER"" COÑO.-",1.44,0.38,1.35,1.28,0.43,0.2,4.96,0,0.68,0.87,0.16,0.39,1.63,1.02,0.63,0.69,1.06,0.69,0.55,6.21
Y A TITE.,0,0,0.17,0.2,0.2,0.15,0,0,0.31,0.37,0,0,0,0,0,0.13,0,0.21,0,0
Y por qué no colocan la foto en donde aparece sin la mascarilla? Algún día un poco de dignidad?,0.23,0.15,0.66,0.59,0.59,0.45,0.9,0.43,0.31,0.56,0.28,0.34,0.65,0.35,0.55,0.52,0.91,0.84,0.63,0.26
Menos mal que no andaba sin traje de baño.,0.15,0.38,0.58,0.52,0,0,0.91,0.5,0.17,0.22,0,0.4,0.62,0.21,0.16,0.17,0.35,0.46,0,0.35
"este sñor, no tiene cabeza, para pensar siquiera en el sentido comun, es una persona que no merece estrar donde esta...asi de simple.....",0.46,0.45,0.83,0.59,0.39,0.45,0.9,0.64,0.47,1.12,0.56,0.68,0.65,0.71,0.41,0.66,0.61,0.42,0.31,0.52
"Si tiene, pero conectada con el cu.lo.",0.13,0,0,0.44,0.22,0,0.4,0.48,0.18,0.42,0.48,0.96,0,0.4,0,0.15,0.34,0.24,0.18,0
No hay caso.... este señor no tiene neuronas. Todo lo hace mal. Es un desastre desde la mañana a la noche. Voté por el y me arrepiento al máximo.,0.81,0.35,1.56,0.91,1.18,0.52,1.26,0.5,1.12,1.32,0.17,0.4,0.57,0.83,0.16,0.46,0.53,1.53,0.74,1.68
"TANTO COLOR LE PONIS POR UNA CA GA DE MASCARILLA ? , ANDA AL SIQUIATRA W E O N,",0.12,0.3,0.66,0.59,0.39,0.45,1.63,0,0.47,0.56,0.28,0,0.33,0.18,0.14,0,0.46,0.63,0.47,3.14
"L a autoridad sanitaria dijo que “elusocorrecto de lamascarilladebe ser siempre y en todo el país. Hay excepciones, al comer, al disfrutar del mar, pero ya sea alaire libreo en espacios cerrados, elusode lamascarillaes fundamental”, reiteró. 15 nov. 2020 Ministro de Salud",0.87,0.64,1.25,2.1,0.85,1.12,1.92,1.37,0.34,1.61,1.21,1.28,1.58,1.33,0.88,1.41,1.14,0.23,0.68,1.62
"Cuan antipático se hace este gobierno! Cero amor por la Patria y su gente. Impuestos y multas, son sólo para el pueblo.",0.54,0.35,0.59,0.46,0.71,1.06,0.63,0,0.19,1.33,0.67,0.8,0.58,0.63,0.81,0.46,0.9,0.26,1.11,1.12
Alaraquiar demás es otra característica de las ra.tas como tú,0,0.3,0.17,0.59,0.59,0.15,0.54,0.21,0,0.37,0.28,0,0.16,0.53,0.27,0.13,0.61,0,0.16,0.79
"Si .""ESTAN DESTRUYENDO EL PAIS",0,0,0.2,0,0.22,0,0.31,0,0,0,0,0,0,0,0.16,0,0,0,0,0.73
Qué habremos hecho para merecer a este descriteriado. Simplemente charcha. Sólo sabe especular en la bolsa y evadir impuestos.,0.24,0.16,0.17,0.82,0.62,0.47,0.38,0.67,0.33,0.98,0.15,0.36,0.69,0.19,0.29,0.69,0.48,0.45,0.17,0.54
Todos queremos andar sin mascarilla. Si andaba solo con sus escoltas qué problema hay??,0.14,0,0.2,0.24,0.25,0.36,0.87,0.26,0.19,0.68,0.17,0,0.59,0.21,0.67,0,1.11,0.53,0,1.42
¿DONDE PODEMOS CONSEGUIR UNA ESCOLTA PARA PASEARNOS A POTOPE POR UNA PLAYA ?,0.46,0.6,0.66,0.98,0.78,0.45,0.93,0.21,0.47,0.94,0.42,0.34,0.49,0.53,0.41,0.39,0.46,0.63,0.79,1.05
Hasta ahi?..todo muy bien Luego se saco selfies con varias personas..y sin mascarilla..hasta ahi todo mal... El hombre nace bueno...la sociedad lo corrompe... Este sujeto penso en quinto basico..que seria un delincuente?,0.36,0.16,0.7,0.21,0.83,0.31,0.94,0.22,0.99,0.59,0.59,0.36,0.69,0.19,0.43,0.28,0.64,0.67,0.66,0.8
"Se robo un banco, el dictador lo salvo.Participo en el caso cascadas, recibió una multa irrisoria.compro acciones de una pesquera peruana mientras estábamos en la haya contra Perú, muchos lo felicitaron. se pasea por la playa sin mascarilla y el seremi dice que como no fue fiscalizado nada se puede hacer.Piñera se ríe de todos los chilenos y nada le pasa.",1.59,1.59,2.47,2.49,3.14,1.27,2.47,1.13,1.83,1.99,1.65,0.72,1.91,1.13,1.89,1.39,1.61,1.81,1.67,1.34
se rie de los weo nes jajaja,0.12,0.15,0,0.2,0,0.15,0,0.21,0.16,0.37,0,0,0.16,0,0.14,0,0,0.42,0.16,0.52
acusaloo con tu mama quikoooooo jja. estabas en la haya?' jjja por eso no te distes cuentaaaaaaa locoooo jja.,0.12,0.3,0.33,0.59,0.78,0.3,0.72,0,0.31,0.94,0.14,0,0.33,0,0.27,0.13,0.3,0,0.63,0.52
TE HAS GANADO UN UNGUENTO PARA EL ANO GILIPOLLA.-,0,0,0,0.48,0,0.18,0.57,0,0.2,0.23,0.17,0.21,0.4,0.22,0.17,0.16,0.19,0.27,0,0
"Bueno, ya no sorprenden las imbecilidades de este payaso y sus disculpas. Hace todo lo que no debe hacerse. Tendrían que multarlo.",0.26,0.34,0.38,0.44,0.68,0.34,1.22,0,0.54,1.06,0.32,0.19,0.74,0.6,0.62,0.6,0.52,0.98,0.36,1.66
"ANDA A LAS POBLAS, NADIE RESPETA NADA, NI MASCARILLAS NI NADA, PURO SHOW",0.25,0.48,0.36,0.63,0.85,0.64,0.75,0.46,0.51,0.4,0.3,0.18,0.7,0.19,0.15,0.56,0.49,0,0.51,0.54
"LAS POBLAS SON PRESIDENTES ,NO LO SABIA.",0.23,0.3,0,0.2,0.2,0.3,0.47,0.21,0.31,0.19,0.14,0.34,0.33,0.18,0.14,0.13,0.46,0.42,0.16,0
Lo único que hace bien es enriquecerse en forma ilicita,0,0,0.4,0.47,0.24,0.18,0.64,0.26,0.19,0.45,0.34,0,0.39,0.42,0.33,0.31,0.55,0,0,0.28
eres un perdedor y envidioso ... ¿que has logrado por tu cuenta?,0,0,0,0,0,0.18,1.06,0,0,0.22,0,0,0.39,0.21,0.16,0,0.36,0,0.37,1.12
"Piñera dando el pésimo ejemplo de movilidad y desplazamiento entre Regiones para que la ocurrencia de nuevos casos diarios de Covid-19 que tenemos en Chile se transforme en un cuento de nunca acabar...o peor, que venga una segunda ola todavía mayor que la primera.",1.5,1.31,1.99,2.55,0.86,0.97,3.31,1.16,0.69,1.63,0.77,0.56,1.6,0.77,1.49,1.14,2.48,2.1,0.85,2.17
Y una persona que anda sin mascarilla también queda impune si reconoce su error? O igual hay sumario?,0.36,0.32,0.7,0.62,0.42,0.16,0.94,0.45,0.66,0.79,0.3,0.18,0.52,0.56,0.58,0.14,0.48,0.9,0,0.27
Este es un payaso se rie de los ciudadanos basta te queda poco se acerca la horca a la moneda,0.58,0.15,0.83,0.59,0.39,0.45,1.43,0.85,0.47,0.19,0.56,0,0.33,0.53,0.41,0.52,0.46,1.27,0.31,1.57
y a ti cuanto te queda?,0.12,0,0.33,0.2,0.2,0.15,0.36,0.21,0.31,0.56,0.14,0.34,0.33,0,0,0.13,0,0.42,0.16,0
te gusta el deforme. No hay pecado,0.18,0.24,0,0,0,0,0.84,0.33,0.26,0.29,0,0.27,0.77,0.56,0.22,0,0,0.36,0.25,0.32
"y a ti ton ti to al cuadrado.... empleado del PC, fogatero y narco terrorista, creo que un día de estos te van a sacar a dar una vuelta en helicóptero.",0.24,0.47,1.54,1.04,1.19,0.95,1.13,0.88,0.63,1.54,0.73,0.35,0.17,1.1,0.85,0.7,0.78,0.65,0.81,2.23
"Ayer estuve en la playa en Viña y creo que menos del 30% de las personas tenían mascarilla de manera adecuada.... me parece de una hipocresía notable que ""salgan a hacer un show"" por lo de Piñera cuando la sociedad en general toma las medidas de manera poco prolija. El titular debiera ser otro en donde se exponga la superficialidad del compromiso con la prevención que los visitantes a las playas tienen.",2,1.95,2.88,2.75,2.58,1.94,4.08,1.62,2.05,2.84,1.38,2.03,2.12,1.54,1.49,2.13,1.98,1.86,2.04,3.79
"Se supone que es el ""Presidente"" y debe dar el ejemplo. O no ?",0.12,0.15,0.5,0.59,0,0,0.54,0.21,0.16,0.19,0,0,0.16,0.18,0.41,0,0.15,0.21,0.31,0
"LARRY PRESIMIENTE , EL ROBA Y MIENTE.",0,0.19,0,0.78,0,0,0.59,0,0.17,0.22,0,0,0.21,0.21,0.16,0,0,0,0,0
