"Tenemos que entender las enfermedades mentales, esa familia no debería que afrontarlo solo pero lamentablemente así funciona chilito.",0.52,0.51,1.08,1.14,0.61,0,1.42,0.69,0.33,0.81,0.61,0.74,0.37,0.96,0.74,0.76,0.82,0.44,0.51,0.61
"No sé si será verdad, pero que sean médicos ya hace las cosas menos entendibles",0.12,0.32,0.51,0.42,0.2,0,0.75,0.22,0.16,0.39,0.58,0.18,0.52,0.18,0.28,0.42,0.47,0.43,0.49,1.12
"El intento de suicidio no es normal. Cualquiera sea su forma debe ser considerada como una enfermedad, el auto mutilarse es muy malo desde cualquier punto de vista.",0.74,0.96,1.25,1.04,1.27,0.64,1.34,0.46,0.67,1.4,0.91,0.18,1.22,0.95,0.59,0.56,1.95,0.69,1.01,1.35
"No sé de que estás hablando, yo digo que si es verdad que sus padres son médicos presumo que tienen plata y conocimientos suficientes para ayudarlo. Ahora no sé que diablos tendrá pero tampoco parece que asuma tener un problema.",1.17,1.68,2.02,2.2,0.79,1.07,3.47,1.73,0.62,2.27,0.43,0.34,2,1.25,1.25,0.54,2,1.28,1.75,2.69
"al final se come el pollo con la boca al mismo tiempo que el perro come pollo, es algo dantesco.",0.74,0.24,0.68,1.37,1.19,0.52,1.72,0.88,0.95,1.8,0.97,0.94,1.04,1.46,0.75,0.92,1.67,0.26,0.65,1.38
me acordé de este conchetumare,0.12,0,0,0,0.2,0.15,0,0.21,0,0.37,0.14,0,0.16,0.18,0.14,0,0.3,0.42,0,0.26
"The VOMELETTE, se me revolvio el estomago de solo verlo. jackass estaba 10 años adelantado en el tiempo.",0.13,0.17,0.37,0.44,0.67,0.17,0.4,0.24,0.18,0.42,0.47,0.19,0.55,0.2,0.15,0.29,0.17,0,0.53,0.55
Y los van a formalizar por tráfico de drogas. Suena como un momento muy xd del ministerio público,0.23,0.6,0.5,0.78,0.59,0.6,0.54,0.21,0.31,1.12,0.28,0.17,0.49,0.35,0.27,0.66,0.61,0.42,0.31,1.83
"Están en prisión preventiva por al menos dos meses por infracción a la ley N° 17.798 sobre el control de armas y explosivos, la formalización que se realizará es por infracción a la ley 20.000 de drogas. Finalmente se precisó que Daniel y Sebastián Queipul están siendo investigados también por el delito de tráfico de drogas, luego de una venta que superó el kilo de marihuana, efectuada el pasado 1 de julio. Detienen a 2 integrantes de comunidad Temucuicui de Ercilla comprando más de 500 municiones",1.55,3.12,2.72,2.86,2.57,1.25,2.42,1.75,1.42,3.64,0.87,1.57,2.71,2.72,2.25,1.65,2.65,3,1.93,4.12
"Un kilo de marihuana"" más o menos, 2 metros cuadrados de plantas considerando que vendieron cogollos secos o wow un gran golpe contra el narcotráfico/s, se lee como que se lo sumaron para verse más bacanes, no quiero decir con esto que no hay que perseguir delitos con son el tráfico de municiones, pero. ¿Por qué estaban vigilando a estos dos wn?",0.59,1.86,2.06,2.01,1.01,1.69,4.62,1.32,1.13,2.12,0.73,1.58,2.36,1.46,1.7,0.95,3.14,1.32,1.78,2.65
"Infiero que primero estaban espiando al armero, luego sacan la autorización para espiar al contacto que hace la transacción con la comunidad de temucuicui y finalmente la autorización para espiar a estos 2 que cayeron presos. Aunque pudo ser al revés porque por el edit que puse agregando info a mi comentario, no se dedican a vender lechugas.",1.35,1.77,1.39,2.33,1.4,1.3,4.02,1.56,0.8,2.34,1.47,1.06,4.19,0.92,1.43,1.14,2.7,1.52,1.47,1.42
No sabemos si son hortalizeros o tu dices que se ganaban las Lucas vendiendo droga?,0,0.52,0.73,0.23,0.41,0.54,1.04,0.23,0.49,0.21,0.31,0,0.76,0.19,0.3,0.31,0.67,0.45,0.86,0.31
santiaguino que no a pisado la Araucanía be like,0,0,0.17,0.39,0.2,0,0.54,0.21,0.16,0.56,0.14,0,0.16,0.35,0.27,0,0.46,0,0.31,0.79
Que tan normal es la compra de municiones de esta manera? Hablo como serenense acostumbrado con campos poco acostumbrado de andar armados,0.58,0.6,0.83,1.56,0.59,0.6,1.43,0.43,0.78,1.12,0.42,0.68,0.65,1.06,0.27,0.52,0.46,0.21,0.79,1.05
"Lo normal es tener armas de caza, te cuentan las municiones y necesitas permiso, hasta pruebas psicológicas se necesita, en Chile por lo menos es súper regulado.",0.38,1.67,2.03,1.95,1.33,1.49,3.38,0.47,0.7,1.87,0.47,0.57,1.45,1.38,0.46,0.58,0.84,0.24,1.92,0.82
"eso lo sé, por eso. Que tan común es comprar municiones en negro?",0.23,0.3,0.5,0.39,0.39,0.45,0.9,0.43,0.47,1.31,0.28,0.51,0.49,0.18,0.14,0.26,0.61,0.63,0.31,1.05
"Buena pregunta, yo sólo sé a través de que lo común es que milicos vendan al mercado negro ya sea actuando víctimas de robo, actuando un robo o derechamente vender lo que es descartado a destrucción. No veo tan fácil hacer llegar armamento a Chile que no sea para fuerzas armadas, a menos que sea a través de mulas en el norte.",0.91,1.02,1.26,2.72,1.43,1.21,4.24,1.15,1.63,3.03,0.61,1.65,1.66,2.1,1.92,1.22,1.97,1.99,1.19,3.65
"Pero acá se compro a un armero pero sin la boleta, más que un tráfico más complejo.",0.12,0.45,0.83,0.39,0.78,0.75,0.72,0,0.16,0.75,0.28,0.17,0.65,0.53,0.27,0.52,0.61,0,0,1.57
No he pisado nunca una araucaria :(,0.12,0.3,0.33,0,0.2,0,0.18,0,0.62,0.19,0.14,0,0.16,0,0.27,0,0,0.21,0.16,0
"Viendo la lista de personas que desaparecieron misteriosamente pre-1970 en la wikipedia, vi que hay un Chileno famoso. A ver si adivinan quién es antes de abrir el link. https://en.wikipedia.org/wiki/List_of_people_who_disappeared_mysteriously:_pre-1970",1.03,0.67,0.56,1.31,0.22,1.17,2.61,0.72,0.71,1.89,0.63,0.38,1.28,1.59,1.38,0.44,2.56,0.73,0.7,1.92
"Como lectura necturna son entretenidos esos artículos, aunque me gusta mas los que desaparecidos... aparecieron. https://en.wikipedia.org/wiki/List_of_solved_missing_person_cases",0.14,0.89,0.99,0.93,0.96,0.89,1.71,0.25,0.57,1.11,0.34,0.41,0.78,0.42,0.82,0.16,0.91,0.52,0.75,1.13
Más perdido que Luciano Bello,0,0,0,0,0,0.15,0.18,0,0,0.19,0,0,0.33,0,0.14,0,0.15,0,0.16,0
Alguien sabe donde venden teclados a un precio un poco mas económico? hace rato que quiero un teclado/sintetizador yamaha (modx8 o mx88) pero están super caros en comparación a 1 año atrás. Me sale más barato encargarlo de afuera o es mucho riesgo? quería cachar con el black friday gringo pero no sé ni en que paginas ver además de amazon y.y,1.17,1.07,1.85,2.58,1.59,0.91,3.09,1.73,1.9,1.71,1.58,0.52,1.49,1.44,0.84,1.86,1.39,2.15,1.28,3.16
Los Bielorrusos se fueron a paro general hace como 2 semanas y lukashenko esta ahí tan contento.,0.55,0.18,0.39,0.23,0.48,0.35,0.21,0.76,0.38,0.67,0.67,0.61,0.19,0,0.33,0.16,0.18,0.52,0.19,0
"putin está en su peor momento la mayoría de las ex repúblicas soviéticas esta con problemas, la idea de aumentar influencia en su zona se le escapó de las manos. En cualquier momento se polarizan y terminan como crimea.",0.51,0.83,1.59,1.98,2.03,0.5,1.18,0.45,1.13,0.6,0.9,1.09,0.9,0.94,0.29,0.59,0.97,1.53,1.34,2.36
"No todas, los checos que yo sepan están piolas no en bolas muy homofóbicos/autoritarias o con guerra en la frontera",0,0.82,0.73,0.21,0.22,0.49,0.78,0,0.52,0.2,0,0,0.18,0.19,0.75,0,0.33,0.24,0.34,0.54
"Czechia nunca formo parte de la URSS, y su gobierno es bastante nefasto, ademas de formar parte del Grupo de Visegrado.",0.69,0.45,0.66,1.37,0.78,0.45,0.72,0.64,0.93,0.75,0.56,0,0.33,0.71,0.69,0.92,0.46,1.06,0.31,1.57
"No fue parte pero su relación cultural con la urss no puede ser saltada y well shit se me cayeron, el autoritarismo deja la caga en todos lados, es como una herida que no sana la wea.",0.82,0.77,1.01,1,0.59,0.77,1.46,1.08,0.47,0.76,1,0.52,1.17,0.54,0.69,0.54,0.92,0.64,0.48,0.81
"https://www.biobiochile.cl/noticias/internacional/america-latina/2020/11/08/argentina-admite-que-ara-san-juan-fue-hallado-1-ano-antes-por-buque-chileno-no-quiso-reconocerlo.shtml Loco, que feo, no podis jugar con las familias de los marinos por un año entero por plata. Also la ayuda desinteresada de todo el mundo botada a la basura, que vergüenza que haya gente así, sobre todo en el mundo marino, donde usualmente hay más respeto a la vida y familias",1.71,1.12,1.41,4.36,2.94,1.27,5.34,1.81,1,4.18,1.65,1.09,2.26,2.64,1.9,1.53,1.94,3.64,2.17,2.42
"Aún así no es tan malo como lo que paso con el submarino ruso Kursk, en donde los locos seguían vivos, pero Rusia no tenía los equipos necesarios para sacarlos, otros paises ofrecieron ayuda ya que contaban con la tecnología para hacerlo y Putin se negó. Cuando el wn aceptó luego de la presión de su gente ya estaban todos muertos.",1.01,0.99,2.37,1.5,1.31,2.13,3.54,0.47,1.21,2.88,0.46,1.12,2.33,1.56,1.5,0.72,2.34,0.94,2.24,3.81
Lo mismo hizo la Marina chilena hace un tiempo con un bote de pescadores. No ayudaron ni dejaron a los demás pescadores ayudar a sus colegas que lentamente se ahogaban dentro de la embarcación. Por ahí anda el vídeo.,0.85,0.96,1.21,0.63,0.4,0.8,2.28,0.66,0.79,1.94,0.15,0.35,1.21,0.55,1.28,0.56,1.26,1.51,1.3,2.82
"Oof, pensaba que lo del kursk fue en la guerra fría. Me voy a pegar una repasá de los hechos",0.12,0.49,1.05,0.21,0.8,0.66,0.77,0.45,0.48,0.79,0.15,0,0.53,0.56,0.43,0.14,0.48,0.43,0.66,1.73
Gracias por darle palabras a lo que pensaba,0,0.34,0.19,0.22,0,0.34,0.81,0,0,0.42,0,0,0.18,0.2,0.15,0,0.34,0,0.35,0.28
habian 44 personas en el submarino y segun wikipedia habia la vida de gente buscándolo de un monton de paises. Todo para que: el gobierno de Mauricio Macri y la oficialidad de la Armada retrasó el hallazgo de la nave por razones económicas. igual una parte conspiranoica mia piensa que podría haber algo en el submarino que argentina no quería se supiese por lo cual obstaculizaron su encuentro desde droga hasta un enfrentamiento con inglaterra,1.35,1.6,1.9,2.95,1.6,1.77,3.43,2.66,1.11,2.92,0.59,1.59,1.56,1.66,2.14,1.27,2.85,1.95,1.96,3.12
"Descarta el enfrentamiento, la misma RN estaba ayudando en el SAR, lo de la droga no tiene mucho sentido, que yo sepa usuhaia no es un centro de producción de droga tan grande como para necesitar un vehículo tan caro.",0.82,0.77,1.85,2.4,1.38,1.07,3.1,1.29,0.94,2.46,1.43,0.52,1,1.43,0.83,0.67,1.69,1.28,1.11,1.61
"Cacharon que el articulo dice que el submarino mediria 33 metros ya que se habria deformado por la presion. Revise en wikipedia cuanto media originalmente y dice que 65 metros. La wea brigida, quedo comprimido a la mitad de lo que era.",0.48,0.16,1.36,0.82,1.39,0.16,2.05,1.09,0.63,1.34,0.72,0.7,1.7,0.73,1.12,0.96,1.4,1.71,0.97,1.65
"Sonó tan fuerte que los micrófonos hechos para detectar explosiones nucleares lo captaron a miles de kilómetros, lo único consolador de algo así es que los marineros no sufrieron...",0.79,0.51,0.94,0.89,0.45,0.51,0.61,1.45,0.72,0.64,0.64,0.19,0.93,0.4,0.62,0.75,1.38,0.25,0.71,1.38
los marineros no sufrieron durante todos los minutos previos mientras se hundían?,0.13,0.35,0.58,0.23,0.7,0.35,0.21,0,0.19,0.44,0,0.2,0.38,0,0.32,0.15,0.53,0.25,0.37,0.56
"al final no hubo un contagio masivo en chile después del 25 de octubre? ya pasaron los 14 días de asintomatia. además desde julio los casos se estancaron, mientras en españa aumentan las medidas de resguardo aca en chile las comunas pasan a fase 4 de desconfinamiento.",1.17,1.37,2.01,2.99,1.18,0.76,2.37,1.08,0.78,1.89,0.86,0.86,1,2.69,0.55,1.21,1.38,1.06,1.43,1.61
"Yo creo que porque a diferencia de EEUU y Europa, aqui se usa harto la mascarilla. Bien, mal, y a veces, pero se usa. Habia un weon grabando en las calles de Londres por harto rato y nadie usaba nada.",0.72,0.47,1.87,1.23,0.99,1.25,1.68,1.09,0.94,0.96,1.16,0.35,0.34,0,0.84,0.69,0.93,1.28,0.8,2.48
Ver las muertes diarias del 7 de junio es impactante.,0.14,0.35,0.37,0.48,0,0,0.63,0,0.17,0.42,0,0,0.19,0.2,0.15,0.16,0.17,0.23,0.35,0
"Por ahora el verano es nuestro aliado gracias a la alta radiación solar que hace bajar la circulación del virus. El problema es que la gente se relaje mucho hasta que comience el otoño, el frío y la humedad que favorecen la expansión del virus.",0.69,0.45,1.66,1.37,1.17,1.04,2.68,1.28,1.09,1.68,0.71,0.17,1.3,0.71,0.96,0.66,1.82,1.27,0.63,3.93
Al menos no hubo efecto votaciones ni efecto marcha del 18O. La 2da ola puede venir igual y el sur está bien complicado. Quizás el efecto verano ayude a qué sea más manejable,0.56,0.91,1.51,1.24,0.42,0.76,1.74,0.73,1.17,1.28,0.16,0.39,1.19,0.8,1.09,1,0.86,0.68,0.71,1.33
ojala el efecto verano sea real y la vacuna nos llegue antes de junio.,0.31,0.41,1.13,0.26,0.28,0.4,0.24,0.58,0.22,0.51,0,0,1.11,0.24,0.37,0.71,0.62,0.6,0.64,0
"Cómo van las cosas con Rozas, a este paso ya me veo protestando con un Paco al lao",0.38,0.82,0.35,1.3,0.4,0.66,1.56,0.22,0.48,0.79,0.6,0.54,0.71,0.93,0.72,0.58,1.28,0.65,0.33,1.16
💀 yop esperando que los mods hagan otro thread de citas,0.28,0,0.6,0.23,0,0.18,0.21,0.51,0.19,0,0,0,0.78,0,0.33,0.31,0.18,0.26,0.19,0.28
"Tu y yo, sentados en el sofa viendo r/Awww y comiendo pan casero. No lo sé, piénsalo",0.23,0.15,0.33,0.59,0.39,0.45,0.36,0.21,0.62,0.37,0.14,0.17,0.16,0.35,0.14,0.26,0,0.63,0,0.52
que sea constitucional,0,0,0,0,0,0,0.18,0,0,0,0,0,0.16,0,0.14,0,0.15,0,0,0
"No pensé que tendrian apoyo ambos threads, tanto el de los sabados como el de citas xd",0.36,0.16,1.03,1.24,0.4,0.47,0.94,0.22,0.63,1.16,0.58,0.18,0.85,0.73,0.14,0.55,0.16,1.07,0.16,0.55
que vuelvan los threads de los sábados!,0.12,0,0,0,0,0.15,0.54,0,0,0.19,0,0,0.16,0.18,0.27,0,0.15,0.42,0,0
"Apoyo la moción, con toda violencia!",0,0.19,0,0.26,0.64,0.4,0.68,0,0.17,0.44,0.16,0.2,0,0.21,0.32,0.17,0,0.23,0.37,0.7
ya somos dos,0.12,0.15,0,0.2,0.39,0.15,0,0.21,0.16,0,0,0,0,0.35,0,0,0.15,0,0.31,0
Con ese username no entiendo cómo puede ser eso,0.23,0.15,0.33,0.2,0.2,0.3,0.36,0.21,0.16,0.19,0.14,0,0.33,0.18,0,0.39,0.15,0,0.31,0
"Por el amor del bebe Jesús, Sparks es una banda de rock excepcional.",0.58,0.76,1.12,0.33,0.71,0.5,0.3,0.72,1.14,0.63,0.48,0.58,0.28,0.6,0.23,0.22,0.51,0.77,0.27,0.67
Sparks Brian May estuvo a punto de ser su guitarrista,0.35,0.3,0.5,0,0.2,0,0.18,0,0.16,0.19,0,0,0.16,0.18,0.27,0.13,0.15,0,0,0.52
"siempre he querido saber qué jugos o bebidas serán ricas/sabrosas sin ser toxicas, no solo para la caña sino como casi un gustito porque igual me aburro de tomar siempre ice tea o agua benedictino (y sus subrproductos)",0.62,0.65,0.72,1.68,0.43,0.64,1.16,0.46,0.51,1.41,0.46,0.55,1.23,1.14,0.74,0.42,1.15,0,0.68,1.08
"Los jugos generalmente son más ricos (y harto más caros) que los néctares. Fíjate en el pasillo donde venden el jugo quillayes de naranja, que es solo naranja exprimida, sin azúcar ni otras cosas, también venden el ""exprimido"" de watts, y el AFE, que el de ciruela lo encuentro bastante rico. Normalmente no están donde mismo encuentras los nectar.",0.83,1.09,2.06,2.22,1.83,1.23,2.96,0.88,0.81,1.55,0.73,0.53,2.53,1.46,0.99,1.08,1.73,1.32,1.62,2.66
Su limonada de menta,0.12,0.15,0,0,0.2,0,0.18,0,0.16,0.19,0.14,0,0.16,0,0,0,0.15,0.21,0.16,0
"Si la encuentras, Socos de manzana es mas rica que la cresta.",0.14,0.19,0.42,0.49,0,0.19,1.12,0.53,0.2,0.23,0,0,0.61,0.22,0.17,0.16,0.76,0.27,0.39,1.44
A mi me gusta comprar agua con gas y le pongo te verde con maracuyá y naranja o jengibre le da un sabor medio picante muy rico uwu,0.66,0.51,1.33,1.78,1.14,0.68,1.84,0.97,1.09,1.5,0.81,0.39,0.75,1.42,0.78,0.45,0.69,1.98,1.26,0.83
Hombre de cultura.,0,0.15,0.17,0.2,0,0,0,0.21,0,0,0,0.17,0,0.18,0,0.13,0.15,0,0,0
Yo estoy tomando aguas con sabor marca Aquarius. Son super ricas y bastante economicas.,0.3,0.39,0.64,0.75,0.26,0.19,0.46,0.27,0.62,0.24,0,0,0.63,0.68,0.35,0.17,0.2,1.13,0.4,0.29
¿Por qué no?,0,0,0.17,0,0,0,0.18,0,0,0,0,0,0.16,0,0.14,0,0.15,0.21,0,0
"Si bien acá la mayoría de la prensa vale pico, esperemos que nunca lleguemos al nivel de creerle todo a solo un wn porque la prensa lo odia.",1.33,0.58,2.13,2.01,1.31,1.34,1.84,1.1,0.83,1.44,0.91,0.87,0.42,0.91,1.06,0.34,0.78,1.98,1.01,0.29
"Que manera de entender mal el problema de la prensa. El problema de la prensa es que la opinion publica este completamente moldeada por lo que la prensa al unisono, diga. Sabes la ultima vez que paso algo asi? en Argentina, cuando salio macri, gracias a la oposicion de Clarín a Kirchner. Esta bien que haya un cuarto poder. Pero esta mal que lleguen al punto de intervenir sobre los procesos oficiales",1.2,1.1,4.27,2.06,1.78,1.73,4.49,1.09,0.95,2.69,1.16,0.7,3.4,2.36,1.83,0.83,3.75,1.29,1.61,4.42
"No he dicho lo contrario. El problema recae cuando llega el mesías que ataca a la prensa y se transforma para muchos el que realmente tiene la información correcta y el que trae conspiraciones a luz. El tema de Qanon nació gracias a la desconfianza de la prensa y está bien, pero cuando te das cuenta que Qanon esta todo el rato con trust the plant, emperor Trump will save us, la wea se fue a la mierda y ya es un culto.",1.11,2.09,4.63,2.72,3.18,2.88,3.84,0.91,1.35,3.21,0.91,1.09,4.02,1.52,1.32,1.97,2.93,2.29,2.36,2.7
"VisualPolitik hizo un video del proceso constituyente Chileno, opiniones?",0.35,0.3,0.33,0.39,0.59,0.6,0.36,0.43,0.62,0.56,0.28,0.17,0.16,0.35,0.27,0.26,0,0.42,0.31,0
Nunca entendí la gracia de ese canal. Encuentro que su contenido es muy superficial.,0,0.16,0.34,0,0.2,0.16,0.57,0,0.32,0.58,0.15,0,0.69,0.18,0.71,0.14,0.47,0,0.16,1.12
Desde que vi el video sobre las protestas ya no los pesco.,0.26,0.85,0.72,0.68,1.02,0.35,1.42,0.69,0.65,0.41,0.31,0.55,0.74,0.38,0.59,0.31,0.66,0.44,0.68,0.61
Yo vi uno sobre el sueldo mínimo y chao con ellos,0.23,0.15,0.33,0.39,0.2,0,0.72,0.43,0.31,0.37,0.14,0.51,0.33,0.18,0.14,0.26,0.3,0.42,0.16,0.52
parecen weones discutiendo en los comentarios,0.12,0,0.17,0.39,0,0.15,0,0.43,0,0,0.14,0,0,0,0,0.13,0,0,0,0
Te aburriste de hacer preguntas sobre EE.UU.,0,0,0.2,0,0,0,0.23,0,0,0,0,0,0.21,0,0.16,0,0.18,0.23,0,1.8
"Es como pato navia de los análisis internacionales, eh",0.23,0.15,0.5,0.39,0.59,0.45,0.36,0,0.31,0,0.14,0.17,0,0.53,0.27,0.26,0,0.42,0.16,0.26
¿El mismo que prometió una vacuna antes de las elecciones?,0.13,0.83,0.55,0.21,0.87,0.16,0.2,0.23,0.52,0.41,0.47,0.19,0.36,0,0.15,0,0.33,0.47,0.52,0
Trump había hablado de disponibilidad,0.12,0,0.33,0,0,0,0.18,0.21,0,0.19,0,0,0,0,0,0,0.15,0.21,0.16,0.26
"si el criminal de guerra te dice que te estay pegando el shou, es porque te estai pegando el shou",0.14,0.54,0.93,0.49,0.21,0.37,1.07,0,0,0.84,0.16,0,0.59,0.4,0.62,0.33,0.51,0.23,0.53,1.97
"igual tiene razón (ni idea si siempre a sido así), pero me parece bastante estúpido que se ""oficializa"" que gano un presidente cuando portales de noticias grandes lo ""confirman"" en vez de esperar algún comunicado del organismo correspondiente o el conteo oficial de votos (ni idea si hay un servel equivalente allí)",0.64,2.16,1.77,1.55,1.22,1.86,3.37,1.14,0.97,2.2,0.75,1.09,1.62,1.89,1.32,1.34,1.3,0.88,2.01,2.38
"https://www.reddit.com/r/chile/comments/jmlgaw/_/gbgtn4z No tienen un equivalente, cada estado mide sus votos",0.12,0.15,0.33,0.78,0.39,0.45,0.72,0,0.78,0.19,0.42,0.17,0,0.18,0.27,0.26,0,0.63,0.16,0.26
"Por años ha sido asi y nunca ha habido ningún problema más que el año 2000 por la diferencia de 500 votos entre Bush y Al Gore. Que el número sea ""oficial"" es netamente porque las matemáticas al ser humano nunca le fallan y las mesas que realizan estás estimaciones ya es imposible que se equivoquen sobre todo por la diferencia de votos que hay entre los candidatos. Trump al final está apelando a la ignorancia se muchos sobre el tema y el odio contra la prensa.",1.13,1.48,2.54,1.92,1.3,1.96,4.7,1.17,1.73,3.27,0.62,1.3,3.03,1.36,2.25,1.29,2.16,3.05,1.72,4.35
"terminan el proceso como en diciembre xD por eso esperan a que alguna institución se la juegue, a este punto se sabe que los votos que quedan benefician a Biden y que es prácticamente imposible que Trump de vuelta la diferencia de votos. Como cada estado e incluso cada condado tiene un sistema distinto, el sistema funciona como el pico(Yay! descentralización desenfrenada)",0.86,0.64,1.59,2.49,0.84,0.79,3.62,1.59,1.33,2.78,0.9,1.27,2.43,1.69,1.89,1.67,2.59,1.59,1.34,2.69
"Siempre ha sido así. El 2016 declararon a Trump ganador la misma noche de elecciones pq era bastante evidente que había llegado ya a los 270 votos electorales. Si tuvieran que esperar a que todos los resultados de los estados estuvieran certificados tendrían que esperar hasta el 11 de diciembre, que es la fecha límite para California.",1.21,1.4,1.94,1.82,0.7,1.39,3.34,1.74,1.12,2.18,0.99,0.4,1.14,1.45,1.44,0.76,1.6,1.01,1.28,2.79
Ya dejó de ser divertido presenciar su pataleta en tuiter,0.45,0.2,0,0.51,0,0.19,0.23,0.28,0.21,0.24,0.18,0.44,0,0.46,0.18,0.68,0.2,0,0.2,0.59
"No es una pataleta, es su súper plan maestro 900X",0.29,0.74,1.15,0.51,0.43,0,0.44,0.49,0.68,0.65,0.32,0.2,0.4,0.61,0.32,0.17,0.17,0.46,0.36,0.68
Lamestream no es un mal nombre de Twitch.,0.16,0.41,0.68,0,0.28,0,0.98,0.29,0.67,0.51,0,0,0.22,0.49,0,0.18,0.21,0,0.65,0.6
¿Qué opinan de que la coordinadora nacional de inmigrantes tire candidatos para constituyentes?,0.23,0.45,0.33,0.59,0.39,0.45,0.54,0.43,0.16,0.19,0.28,0.34,0.49,0.35,0.41,0.39,0.46,0.42,0.16,0.26
"Me parece bien, ya que como ellos lo manifestaron, llevan años aca, pagan sus impuestos, imponen en Chile y les interesa la gestión de este país más del que de donde vienen.",0.58,0.45,0.66,1.76,0.39,0.6,1.97,0.64,0.31,1.31,0.42,0.17,1.14,0.35,0.55,0.52,1.37,0.21,0.79,2.62
"Creo que es muy bacan. Los candidatos deberían salir desde el activismo social, muchos llevan años peleando y cachan de lo que hablan. Ojalá no votar por famosos o por políticos que salieron de las catacumbas xd",0.92,0.45,0.83,0.78,0.78,0.15,1.43,0.64,0.47,1.5,0.28,0.34,0.82,0.89,0.55,0.39,1.37,0.42,1.1,1.83
"En el Servel salió una nueva lista de vocales de mesa para primarias 2020, junto con cambios de lugar de votación.",0.48,0.47,0.7,0.82,0.41,0.31,0.19,0.67,0.49,0.79,0.44,0.54,0.17,0.56,0.43,0.41,0.64,0.45,0.33,1.07
"Para el plebiscito me cambiaron a un colegio a la cresta de mi casa. Ahora me devolvieron al que estaba antes, igualmente a la cresta de mi casa.",0.81,0.15,0.5,0.59,0.2,0.3,1.61,0.43,0.16,1.12,0.28,0.34,0.33,0.53,0.55,1.18,0.76,0.84,0.16,2.1
"Mi lugar de votacion quedaba a 30-40 minutos de mi casa, en transporte publico. Me cambiaron a otro lugar que queda a 1 hora aprox. de mi casa.",0.23,0.75,0.5,0.59,1.17,0.45,1.79,0,0.62,1.12,0.28,0.34,0.82,0.18,0.82,0.79,1.06,0.42,0.79,1.57
"Me pasó lo contrario, me mandaron de uno a 1 hora aprox en micro, a uno a media hora. Primera vez que me cambian de recinto como en 10 años.",0.23,0.45,0.5,1.17,0.39,0.45,1.61,0.64,0.62,0.94,0.28,0.51,0.82,0.89,0.55,0.79,1.06,0.63,1.26,1.05
"Shi, me cambiaron a tres cuadras por fin",0.23,0,0.17,0,0,0.3,0.18,0.21,0.31,0.37,0.14,0.17,0,0.35,0,0.13,0,0.42,0.16,0
"Tras una larga serie de eventos desafortunados, considero seriamente irme del pais. Soy profesor de ingles y pensaba en estudiar algo afuera, quisiera irme a Escocia o Nueva Zelanda, que tan dificil es hacerlo? Validar mis estudios igual? Pd: Estoy al tanto de lo inutil que son mis estudios en un pais de habla inglesa.",1.5,1.05,2.99,2.73,1.56,1.19,2.33,1.7,1.55,1.87,0.56,0.85,2.61,1.77,1.37,1.05,1.82,1.9,0.79,1.31
NZ esta lleno de chilenos,0,0,0.33,0,0.2,0.15,0,0,0,0,0.14,0,0.16,0,0,0.13,0.15,0,0.16,0.26
"Poner tu vida en orden en Chile va ser más fácil que armar una nueva en otro país. Anda de vacaciones, tu solo, a uno de esos lugares, ""despejate"" e intenta de nuevo.",0.68,0.89,1.57,1.84,1.9,1.06,2.12,0.5,0.94,1.11,1.17,0.6,0.77,1.26,0.97,1.08,0.9,1.54,1.11,1.41
Alla ya saben hablar ingles,0.12,0,0.5,0.2,0,0,0.54,0.21,0,0.19,0.14,0,0.16,0.18,0,0,0.15,0.63,0,0.26
puede hacerle clases a inmigrantes o:,0,0.15,0,0,0,0.15,0.36,0,0.16,0.19,0.14,0,0.33,0,0.41,0,0.46,0,0.16,0
Los japonenes necesitan profes de inglés y español (no sé por qué pero parece que les gusta este último).,0.37,0.81,1.05,0.65,0.4,0.49,1.36,0.45,0.16,0.98,0.15,0,1.41,0.56,0.43,0.14,0.8,0.44,0.83,0.87
Por lo que sé es porque fonéticamente es fácil (se escribe como se pronuncia) y les parece exótico.,0.36,0.16,0.53,1.24,0.83,0.31,1.13,1.12,0.33,0.59,0.3,0.54,0.34,0.37,0.87,0.41,0.8,0.68,0.5,0
Y acá no se aprende castellano españolense.. acaso?,0,0.15,0.5,0.59,0.78,0.15,0.18,0,0.47,0.19,0.14,0,0.16,0,0,0.13,0.15,0.21,0.31,0
"Conseguir una visa de trabajo no es fácil, menos en países desarrollados.",0.39,0.34,0.36,0.68,0.82,0.17,0.41,0,0.49,0.61,0.61,0.18,0.55,0.38,0.59,0.46,0.16,0.89,0.51,0.61
"Así es, con las inmigraciones masivas se han puesto duros, hay que llegar casi con contrato listo e indefinido para qje te dejen allá",0.48,0.16,0,0.41,0.41,0.16,1.12,0.22,0.16,0.19,0.44,0,0.85,0,0.43,0.27,0.79,0.44,0.33,1.07
"Para actualizar su vocabulario. Hay un nuevo término que ronda en Reddit: Amber No es Floridaman ni Karen, ahora la moda es Amber. El caso de jhonny depp logró eso xD",0.47,0.77,1.01,1.61,0.39,0.31,1.29,1.08,1.25,0.76,0.57,0.52,0.5,0.54,0.42,0.54,0.93,0.43,0.8,1.35
"El caso de jhonny depp logró eso xD Pero, ""Amber Lamps"" es mas viejo que eso.",0,0.17,0.37,0.66,0.45,0.17,1.01,0.24,0.36,0.21,0,0.19,0.55,0.4,0.31,0.15,0.68,0.24,0.71,0.55
Ah chuta pensé que era mas actual. Te metes a Dankmemes y todos son acerca de la noticia del despido de Warner a depp.,0.23,0.6,1.33,0.78,0.39,0.6,1.43,0.43,0.78,0.94,0,0,0.82,0.89,0.27,0.39,0.3,0.84,0.47,1.57
"Si el actual es actual, pero hay esa referencia pasada",0.25,0.33,0.18,0.43,0.44,0.16,0.79,0.47,0.17,0.82,0.16,0.19,0.36,0.19,0.45,0.29,0.33,0,0.17,0.54
"No entiendo, el Jhonny Depp salió culpable o inocente??",0.17,0,0.48,0,0.3,0.22,0.26,0,0.24,0.27,0.2,0,0.24,0.26,0.2,0.38,0.44,0,0.45,0
"Uno de estos diarios amarillistas britanicos lo llamó ""abusador de mujeres"". Él los demandó por difamación y perdió ese juicio porque probar difamación de una figura pública no es fácil. No es que sea culpable ni inocente en ese caso (que es la razón por la que WB lo sacó de Fantastic Beasts). Pero de que mutuamente se pegaban con la Amber, lo hacían.",1.52,1.98,1.94,3.29,2.23,1.84,4.92,1.81,1.45,2.19,1.2,1.44,2.51,2.44,1.89,2.36,3.71,1.31,2.17,3.83
