"Eso mismo, acá por lo que veo en reddit, le ponen las manos al fuego a JD. Pero a pesar de que sea uno de nuestros actores favoritos el wn con estaba metido en una espiral de violencia y toxicidad con la mina que simplemente no es una blanca oveja.",0.63,1.32,2.11,1.97,1.41,1,3.53,0.9,1.61,2.18,1.35,0.9,1.25,0.75,1.16,1.03,1.45,0.87,2,1.76
"Por eso están pidiendo que ley pareja no sea dura, si sacaron a Depp de esa saga, saquenla también a ella de Aquaman y el DCU.",0.24,0.46,1.02,0.61,0.59,0.62,1.11,0.43,0.47,1.14,0.14,0.17,0.67,0.18,0.14,0.54,0.15,0.21,0.48,0.82
"Pos ya fue descartado, tío Choice",0,0.15,0.17,0.2,0.2,0,0.36,0,0.16,0,0.14,0,0.16,0,0.27,0,0.15,0,0.16,0.26
Todos saben que ese software lo hizo Bill Gates pa sacarte el liquido de las rodillas.,0.12,0,0.5,0,0.39,0.15,0.54,0.21,0.31,0.37,0.28,0,0.16,0.18,0.14,0.13,0.3,0,0.16,0.79
Weon que chucha la gente que acusa seriamente que puede haber fraude I see dead people https://archive.is/TB0NR la diferencia no es ni estrecha No lo es?. estan virtualmente con el pais dividido 50/50 Sepan perder de una buena vez. Que la prensa decrete algo no lo hace oficial,1.38,1.15,1.58,1.31,1.21,1.17,2.94,1.35,1.28,1.39,0.75,0.9,1.43,1.5,0.73,0.73,1.29,1.53,0.83,1.46
Un link sin contexto ni prueba de su veracidad no hace oficial el fraude.,0.59,0.58,0.21,0.25,0,0.38,1.15,0.55,0.83,0.48,0.36,0.44,0.63,0.46,0.35,0.34,0.39,0.57,0.2,0.58
"Hay un diferencia de 5 mill de votos, no es el caso 80/20 de acá, pero son 5mill, no es menor compa",0.46,1.05,0.66,0.98,0.2,0.3,1.43,0,0.31,0.75,0.14,0.17,0.82,0.35,0.14,0.66,0.15,0.21,0.79,1.05
"Hay un diferencia de 5 mill de votos EEUU no usa voto popular, sino que por estado. Arizona+Wisconsin+Pensilvania+Georgia sumado tienen solo una diferencia de 90.000 votos. Si por X motivo, Trump revierte eso, él gana.",0.98,1.83,1.7,1.99,1.06,1.33,1.97,0.49,0.84,2.13,0.48,0.39,0.4,0.4,0.78,0.67,1.04,1.37,1.25,2.34
"No discuto eso pa nada, conozco cómo funciona el EC, aún así es un dato importante que en cualquier otra país sería tomado en cuenta, no veo porque no puede ser tomado en cuenta en el caso de usa. Y si jugamos al juego de los números y la importancia de los swing states, no veo porque no podemos hablar de los votos populares y la importancia que tienen por lo menos como medidor de lo que el electorado general quiere.",1.74,1.78,2.44,2.14,2.21,1.64,3.09,2.01,1.6,2.16,0.74,1.25,3.52,1.11,1.58,1.01,1.75,3.26,3.13,1.73
Lo más cuatico es que trump dejó a entrever reiteradas veces que 8 años quizás no eran suficientes en la casa blanca,0.48,0.93,1.19,0.41,0.4,0.62,1.49,0.65,0.31,0.77,0.29,0,1.35,0.54,0.98,0.41,1.09,0.43,0.64,0.55
Justicia es lo que yo pienso que significa,0.14,0,0.21,0.24,0,0,0.22,0.53,0.2,0.23,0,0.21,0.41,0.22,0.17,0.33,0.38,0.27,0.2,0
"No es lo que ustedes piensan precisamente, Social Justice Warriors?",0.23,0.3,0.33,0.2,0.2,0.3,0.54,0.43,0.47,0.19,0,0.51,0.33,0.35,0.27,0.26,0.46,0,0.31,0.26
"Muéstrame donde he hablado de justicia y he utilizado el concepto para intentar reclamarla de mi lado. Sé que te encanta asumir y hacer generalizaciones, pero chanta la moto, que a ti te da ataque cuando alguien hace lo mismo contigo.",0.96,0.16,0.87,1.23,1.03,0.47,2.25,0.89,0.49,1.57,0.74,0.89,1.37,0.56,0.57,1.37,1.28,1.34,0.82,1.6
"Muéstrame donde he hablado de justicia y he utilizado el concepto para intentar reclamarla de mi lado. Todo tu post de ""alegaciones"" no probadas contra trump. EL veredicto de la ""justicia-social"" sin que haya proceso.",0.96,0.47,0.51,1.65,0.99,0.63,2.43,1.31,0.47,1.54,0.87,0.52,1.7,1.27,0.84,0.83,1.72,1.29,0.65,1.94
"Sí, utilizo un listado extenso de casos para informar mi opinión de Trump, en vez de creer que el wn sólo comete errores sin querer y que no se le puede responsabilizar por sus acciones. Si Trump fuera chileno lo detestarías, pero como es gringo y ""he owns the libs"" te deshaces en defensas para él; eres un sicofante, pero de la clase más triste, la que no puede esperar reconocimiento por su adulación.",1.16,1.06,2.17,3.16,1.96,2.42,3.44,2.14,2.18,2.64,1.56,0.86,2.64,1.78,2.07,0.8,2.45,1.69,1.74,3.19
"Si Trump fuera chileno lo detestarías ¿Porque? Si hubiera un lider proteccionista lo apoyaria, siempre que no sea pinochetista. eres un sicofante Wow , un insulto traido directamente del macarthismo ideologico de AOC. No puedes argumentar sin insultar",0.59,0.46,0.68,1.8,0.2,0.92,2.39,1.09,1.28,1.92,1.01,0.7,0.67,1.45,0.7,0.67,0.94,0.44,0.97,1.85
"Sin ánimos de insultar ozz, pero como puedes ser tan insufrible locoo, yo me metía a este mismito reddit hace un año y tu no eras así, ahí no más la dejo, buen dia",0.36,1.1,1.71,1.24,0.79,0.95,1.69,1.1,0.47,0.96,0.58,0.35,0.68,1.46,0.56,0.69,0.94,0.43,1.45,1.39
todo tu comentario fue eso. vale. lindo tu aporte,0.17,0.43,0.96,0.28,0.3,0.65,0.52,0.62,0.48,0,0.2,0,0,0,0.4,0,0.22,0.32,0.23,0.93
"baboso ataque directo, llora. La ""argumentacion"" toxica tuya como siempre",0,0,0,0.59,0.22,0.22,0.25,0.27,0.18,0.47,0.18,0.64,0.23,0.22,0.34,0.2,0.19,0,0.39,1.18
siempre que no sea pinochetista. Lo seria.,0,0.15,0.17,0.2,0.2,0.15,0.54,0,0.31,0.19,0,0.17,0.16,0.18,0.14,0,0.15,0,0.31,0
Politica Ficcion. Alt,0,0,0,0.2,0,0,0.18,0,0,0,0.28,0.17,0,0.18,0.14,0,0.15,0,0,0.26
"Hasta Hillary reconoció su derrota con ver qué trump tenía la delantera, no esperó ni a los medios ni a la corte ni nada. Ten un poco de decencia y deja de mentir.",0.81,1.2,1,1.95,0.59,1.04,2.15,1.07,0.47,1.12,0.42,0.34,0.82,1.77,0.27,0.79,0.91,0.63,1.73,1.57
"Los memes de la derecha chilena deberían estar en la definición de cringe, me recuerda a los niños del jardín cuando se pican por perder, adelante estudio",0.25,0.65,0.88,0.87,0.6,0.99,1.95,0.22,0.32,0.59,0.15,0.18,0.53,0.37,0.58,0.44,0.48,0.22,1.16,1.75
ají verde fue la mejor muestra que los derechistas chilenos no son buenos haciendo humor,0.4,0.35,0.91,0.7,0.21,0.18,1.25,0.23,0,0.41,0.47,0,0.76,0.39,0.45,0,0.67,1.12,0.52,0.31
los de izquierda por que no? xD,0.12,0.3,0.5,0.2,0.2,0.15,0.54,0,0.16,0,0,0,0.16,0.18,0.14,0.13,0.15,0.21,0.16,0.26
"Los memes de izquierda por último tienen gracia y suelen innovar en la cultura memistica en mi humilde opinión, los memes de la derecha generalmente son terrible reaccionarios y muchas veces son solo whatabaoutism. Ahora en el comentario original no me referí a los memes de izquierda, pero diría que la diferencia entre ambos es esa",0.6,1.09,1.72,2.42,1.02,1.7,2.6,0.66,0.81,1.36,0.44,0.35,1.01,1.28,1.14,0.68,1.89,0.66,1.3,3.19
"no se, personalmente me rio de la wea que me den gracia independiente de que sea de izquierda o derecha, aunque tengo que admitir que el socialismo no funciona 😔",0.73,0.95,1.03,1.25,0,0.64,2.08,0.66,0.47,1.16,0.29,0.7,1.2,0.55,0.85,0.7,1.1,0.65,0.65,2.24
aunque tengo que admitir que el socialismo no funciona Lo importante y lo bonito mi rey,0.13,0,0.35,0.66,0,0.17,0.79,0.91,0.16,0.6,0.3,0.36,0.9,0,0.44,0.15,0.48,0.44,0.17,1.18
Hay memes de derecha?,0.12,0,0,0,0,0,0,0,0,0,0,0,0,0,0,0.13,0.15,0,0,0.52
Hay intentos de,0,0.15,0,0.2,0.2,0.15,0.18,0,0,0.19,0.28,0,0.16,0.18,0.14,0,0.15,0.21,0.16,0
Y la mitad involucran helicópteros apaches.,0,0.17,0.36,0.23,0.41,0.17,0,0,0.16,0.2,0.15,0,0,0.19,0,0.15,0,0.22,0.17,0
Erick Pulgar no va a estar disponible para el partido con Perú. Le habrán dicho a Rueda que Chile nunca ha perdido con Perú en Santiago?,0.77,0.17,0.37,1.09,0.22,0.83,1,0.71,0.35,1.46,0.47,0.38,1.45,1.38,0.46,0.29,0.51,0.72,0.88,0.82
La fiore no le autorizo el viaje &gt,0.12,0.3,0.33,0,0,0.45,0.54,0.21,0.31,0,0,0.17,0.16,0.18,0.14,0,0.15,0,0.31,0
Valber es buenisimo. Por qué no cita a Galdames de Velez?,0.23,0.15,0.5,0.39,0.2,0.15,0.54,0.64,0.47,0.19,0,0.34,0.33,0.18,0.41,0,0.46,0.63,0,0.26
"Bonito discurso de Biden, quizás cumpla su objetivo de acabar o por lo menos parar esa tremenda Polarización, lo que me preocupa es que el viejo es neocon y que la VP es 100% sionista.",0.6,0.63,1.37,1.45,0.99,0.79,1.69,0.66,0.63,1.35,0.58,0.88,2.05,0.55,1.13,0.83,1.1,1.07,0.48,0.83
Entiendo que el gobierno nuevo va a estar por la solución de dos estados.,0.26,0.17,0,0.45,0.91,0.51,0.82,0.49,0.54,1.07,0.48,0.19,0.37,0.2,0.47,0.15,0.52,0.74,0.18,0.55
Y más todavía para los usuarios de Windows que quieren migrar a Linux pero no pueden.,0.23,0.45,0.66,0.98,0.78,0.3,1.07,0.43,0.47,0.75,0.28,0.17,0.65,0.53,0.41,0.52,0.61,0.63,0.63,0.26
Tener Linux y poder levantar Microsoft Word o Excel sin preocuparse es demasiado útil.,0.37,0.16,0.18,0.84,0.42,0.48,0.77,0,0.34,0.4,0,0.18,0.52,0.57,0.29,0.28,0.65,0.23,0.5,0.54
"La wea leeeeeeeenda Seguire dejando Ubuntu para el trabajo y windows pal ocio, pero esto es re leeeendo",0.48,0.31,0.34,0.62,0.59,0.47,0.75,0.44,0.32,0.77,0.43,0.7,0.85,0.73,0.7,0.83,1.25,0.43,0.32,1.11
Yo tampoco creo que cambie Windows 10 pero está mucho más fácil la transición.,0.27,0.17,0.57,0.67,0.69,0.34,1.03,0,0,0.86,0.33,0.39,0.38,0.2,0.47,0.3,0.35,0.5,0.36,0.28
"Me necesito operar, y nunca lo he hecho. Que lugar recomiendan que sirven para operarse? Ahorita tengo puro FONASA.",0.39,0.17,0.72,0.45,0.41,0.69,1.61,0,0.32,0.81,0,0.18,1.47,0.19,0.44,0.3,0.82,0.22,0.85,0.61
Clínica Dávila es de las más baratas dentro de las caras.,0.23,0,0.5,0.39,0.39,0.15,0.36,0,0.16,0.19,0.42,0,0.16,0.18,0.14,0.13,0.46,0.21,0.47,0.52
Si no tienes idea de nada y tienes duda en que en algún lugar te cobren un ojo de la cara por la operación te recomiendo revisar el beneficio del Bono PAD de Fonasa,0.92,0.3,1.33,1.56,0.78,0.3,2.15,0.85,0.78,0.94,0.99,0.68,0.33,0.71,1.1,1.05,0.91,1.48,0.63,1.57
"Depende de la operación, las estéticas son “baratas”, así bien entrecomillas. Rondean entre los 2 y 3 millones. No 9 como usualmente se pensaría. Tendrias que juntar varios ahorros nomas, como una meta a mediano plazo.",0.36,0.77,1.03,1,1.21,0.46,1.66,0.66,0.48,1.35,0.44,0.53,0.84,1.09,0.42,0.4,0.31,0.66,0.97,0.53
"Son las amígdalas, no creo que cuenten como estéticas jajajaja. Es un poquito urgente, así que quiero armarme con toda la información que pueda.",0.24,0.63,0.52,0.81,1.02,0.31,1.68,0.44,0.65,0.19,0.15,0.53,1.19,0.55,1.14,0.14,1.27,0.44,0.98,0.27
"El Bono PAD de fonasa cubre la amigdalectomía, averigua por ahí, la operación debiese salirte como 250 lucas según sé",0.23,0.3,0.66,0.78,0.39,0.45,0.72,0.64,0.47,0.37,0.56,0,0.49,0.35,0.55,0.26,0.61,0.21,0.47,0.79
Geniaaaaaal. Muchas gracias. Me faltarian 100 lucas para llegar a la meta.,0.14,0.18,0.39,0.23,0.24,0.18,0.63,0.5,0,0.44,0.17,0.2,0,0.42,0.16,0.15,0.18,0.77,0.37,0.28
Entonces ármate un pack y acete la bichitomia,0.35,0.3,0.17,0.39,0.2,0.3,0.54,0,0.62,0.37,0.14,0,0.33,0.18,0.27,0.39,0.15,0.63,0.31,0
Depende de cuánta plata tengas.,0,0.15,0.17,0.2,0,0,0.36,0.21,0,0,0.14,0.17,0.16,0,0,0,0.15,0.21,0.16,0
"Pueees soy estudiante universitario recien egresado. Pensaba operarme antes de egresar siendo carga de mis padres en la U, pero alas, covid.",0.86,0.32,0.52,0.85,0.6,0.65,1.15,0.89,0.16,0.78,0.44,0.36,0.52,0.93,0.43,1,0.32,0.22,0.66,0.86
El hospital clínico de la chile siempre es una opción (suponiendo que eres de Santiago).,0,0.3,0.5,0.2,0,0.15,0.72,0.21,0.16,0.19,0,0,0.33,0.35,0.41,0,0.15,0,0,0.52
Le voy a echar un ojo. Gracias men.,0,0.17,0.19,0.22,0,0,0.6,0,0.36,0.21,0.16,0,0,0.2,0,0,0,0.24,0.18,0.55
"Depende de que te quieres operar, si es ambulatorio o no, etc",0,0.49,0.54,0.42,0.21,0.16,0.97,0.46,0.17,0,0.61,0.37,0.71,0.19,0.45,0.43,0.82,0.23,0.34,0.54
"Hace unos días me armé de valor y envie una demo de un juego con petición de trabajo a la compañía dónde hice práctica y en una semana aun no hay respuesta (más que la original de ""un gusto que tengas iniciativa"" y eso...) Sigo esperando o acepto ya que no entre (ya que la demo era muy básica ahora que la reanalizo) y busco pega a otra empresa? Aunque igual es compañía indie/pyme y cuando estuve eramos como 9 cabros así que igual no ha tenido tiempo de ver la demo",2.28,2.03,2.9,4.52,2.38,2.2,4.3,1.75,2.68,3.84,2.46,0.87,2.55,3.45,2.39,2.07,2.65,3.22,1.13,4.97
"Keep trying hmno, las artes demandan pachorra y darle no mas. Pd: soy musico y ando en busca de proyectos de videojuegos, si te tinca ofrezco mis servicios para algún proyecto",0.62,0.48,0.7,1.07,0.8,0.98,1.54,0.89,0.32,1.37,0.44,0.36,0.7,0.74,0.43,0.57,0.64,0.43,0.82,1.44
Aceptaría pero sin sueldo ni nada concreto mejor no arrastro a alguien a algo lleno de incertidumbre. Agradezco la oferta eso sí,0.72,0.62,0.85,1.22,0.59,0.62,1.3,0.22,0.94,1.34,0.43,0.17,0.68,1.09,0.14,0.96,0.47,0.64,0.48,1.37
"Tranqui, no estoy pidiendo plata, la verdad es que me gustaria estar en un peoyectio hace rato y generar mas experiencia, me apasionan mucho los videojuegos. Si te tinca mandame un dm y te mando algunas muestras",0.98,0.8,1.38,2.32,1.4,1.29,1.91,0.89,0.95,1.75,0.73,0.18,1.04,1.29,0.71,0.99,0.95,1.3,0.82,0.57
"Repito, me siento honrado por la oferta, pero prefiero no comprometerme por ahora por temor a acabar decepcionandote. Si quieres te puedo pasar la compañía a la que estoy postulando",0.61,1.26,1.2,2.08,0.8,1.27,1.7,0.66,0.95,1.35,0.87,0.7,0.69,1.1,0.99,0.84,0.94,0.86,1.3,0.84
no dejes de avanzar por quedarte esperando una respuesta,0.41,0.53,0.55,0.24,0.42,0.18,0.63,0.24,0.33,0.42,0.31,0,0.38,0,0.3,0.16,0.68,0.23,0.35,0.64
"Tienes razon, mejor sigo perfeccionando mi curriculum (y la demo porsia) y veo otras empresas, tengo una en mente pero debo tener la opción de más",0.62,0.65,0.89,1.26,0.43,1.12,0.77,0.46,0.85,1.61,0.46,0.37,0.88,1.33,0,0.56,0.82,1.15,0.68,1.62
"no te desanimes, el hecho de que te des cuenta de que tu demo era básica significa que estás aprendiendo cosas nuevas. Llegará el momento en el que te contraten, keep trying =) (lema de vida pal desarrollador xD)",0.37,1.12,1.04,1.26,0.6,0.48,2.28,1.11,0.79,0.39,0.29,0.53,1.73,0.74,1.42,0.71,1.9,0.22,0.98,1.41
"TIL: que Julian Casablancas de Strokes, estuvo en el colegio más caro y elitista del mundo, donde también conoció a los otros miembros de la banda. Yo me lo imaginaba tomando báltica, en los suburbios de Nueva York, pero parece que no. Es firulais.",0.59,0.92,1.19,0.8,0.8,0.46,1.65,0.87,0.64,1.15,0,0.35,1.33,0.72,0.98,0.27,0.93,0.87,1.28,1.59
"donde también conoció a los otros miembros de la banda Sipo, si el papá de uno de ellos tocó en el Festival de Viña",0.24,0.78,1.04,0.61,0.2,0.47,0.93,0.44,0.33,0.58,0,0.53,0.51,0.92,0.29,0.41,0.48,0.22,0.65,1.07
"pero wn xddd, está bien que nuestra imagen de Canadá sea de q es bacán, pero no es el mundo bilz y pap...",0.63,0.98,1.08,1.06,0.65,0.81,1.56,0.23,0.68,0.81,0.31,0,0.89,0.38,0.3,0.85,0.33,0.47,0.51,0.81
a qué va la pregunta entonces?,0,0,0.17,0.2,0,0.3,0.36,0.43,0,0.37,0.14,0.17,0.49,0.35,0.14,0.13,0.46,0,0.16,0.26
"El JB, me cae bien a pesar de ser la imagen de la industrialización de la música. Pero al final era un cabro chico y se tuvo que ganar todo el odio de las redes. Y creo que fue por su padre.",0.35,0.31,1.36,1.4,1,1.37,2.2,0.22,0.8,1.53,0.72,0.17,0.83,1.09,0.98,0.4,1.24,0.43,1.77,1.59
"Si, el papá (y la mamá) son bien white trash. Igual que con la Britney.",0,0.36,0.2,0.47,0.24,0.36,1.07,0,0.19,0.22,0.34,0.2,0.39,0,0.49,0.47,0.55,0.26,0.57,0
ser cuico te hace pesado no es una opinion que esperaba de ti,0.39,0.67,0.72,0,0.41,0.34,0.4,0.46,0.65,0.6,0.3,0,0.18,0,0,0.3,0,0.22,0.17,0.91
"True, es que es una opinion que es super comun en /r/chile, y como generalmente les llevas la contra",0.38,0.17,0.73,0,0.44,0,0.59,0.7,1.04,0.62,0.47,0.19,0.72,0.19,0.45,0.14,0.67,1.18,0.35,0
"gente, últimamente e notado que muchas chicas me miran, pero me da curiosidad de que si es por que me funaron o por que soy relativamente guapo, que opinan? xd",0.48,0.93,1.54,0.6,1.01,0.77,2.03,0.66,0.64,0.77,0.29,0.53,1.35,0.73,0.85,0.41,0.94,1.32,1.14,0.53
"Has entrado a lo que se conoce como tu ""fase popular""...",0,0,0,0,0.26,0.19,0.91,0,0.21,0,0,0,0.21,0.23,0.35,0,0.39,0,0.4,0.58
falta la opción de ser relativamente feo,0.36,0,0.45,0,0,0.26,0.56,0,0.38,0,0.19,0,0,0.24,0.56,0.22,0.62,0.26,0.21,1.35
"Na, incluso se me han acercado para hablarme tipo para conocerme y pues la verdad no se si soy el nuevo meme como el xoxe o algo",0.37,0.32,0.86,0.21,1,0.32,0.76,0.22,0.48,1.36,0.58,0.18,0.52,1.28,0.71,0.14,0.47,0.43,1.14,1.13
Es por tu máscara de ahegao,0.12,0.15,0,0.39,0,0,0.36,0,0,0.19,0,0,0.16,0.35,0,0,0.15,0,0.31,0.79
Ante la duda pasaje a coquimbo,0,0.17,0.18,0.23,0,0.17,0.41,0.23,0.16,0,0.15,0,0,0,0.15,0,0.16,0.22,0,0.31
eso estoy pensando,0,0,0.17,0,0,0,0,0.21,0.16,0.19,0,0,0,0,0,0,0,0,0,0.26
"Como lo único que sé sobre ti es tu nick me guiaré por el, debe ser por estar cubierto en sangre de pajaro, yo igual me daría vuelta pa mirarte",0.58,0.3,0.66,0.78,0.78,0.45,1.07,1.07,0.31,1.87,0.28,0.17,0.65,0.71,0.41,0.39,0.61,1.06,0.47,1.31
"Creo que es por que no lleva pantalones, señor.",0.12,0.15,0.17,0.2,0.39,0.15,0.9,0,0,0.19,0.14,0,0.49,0,0.27,0.13,0.61,0.21,0.16,0.52
Plw me saqué la chucha en un hoyo que no se ve porque le creció maleza xd,0.12,0.32,0.53,0.62,0.63,0.32,1.14,0,0.33,0.59,0.3,0,0.52,0.19,0.58,0.28,0.64,0.68,0.5,0.54
"Anda a cortarlas o avisa al municipio por lo menos. Es una paja, más después de sacarse la chucha, pero hoy fuiste tu, mañana puede ser un niño o un adulto mayor. Te hago un nanai digital: (8)Sana, sana potito de rana, si no sana hoy sanará mañana(8)",0.46,1.05,1.83,1.76,1.95,1.49,1.97,0.43,1.24,1.68,0.85,0.68,1.3,0.89,0.82,0.66,0.61,1.06,1.41,1.05
Muchas gracias por tu nanai y tu sana sana&lt,0.13,0.17,0.55,0,0.22,0.16,0.59,0.23,0.17,0.62,0.31,0.19,0.18,0.58,0.15,0,0.33,0.24,0.52,0.27
listo! suerte con tu encuesta,0,0.27,0.6,0.35,0.38,0.27,0.64,0,0.3,0.34,0,0,0.59,0.32,0.25,0,0.27,0,0.28,0.35
y si considero que el departamento donde vivo esta bien?,0,0.21,0.46,0.55,0.29,0.21,0.75,0,0.46,0.52,0,0,0.68,0,0.19,0.18,0.21,0.31,0.22,0.3
No eres nuestro público objetivo :/,0.12,0,0.17,0.2,0.2,0.15,0.36,0.21,0.16,0,0.28,0,0.33,0.18,0.14,0.26,0.3,0.21,0.31,0.52
tenemos un tipo que se autoproclamó y otro que no quiere irse No es trump esos 2?,0.12,0.45,0.5,0.78,0.2,0.6,1.43,0.43,0.31,0.94,0.42,0.17,0.98,0.53,0.55,0.13,0.91,0.21,0.47,0.52
"Pero si en los mismos canales dijeron, ellos tienen un algoritmo que corren cuando reportan votos y reportan los resultados con un altisimo porcentaje de certeza del resultado final, considerando incluso reconteos que por lo general no hacen variar mas de 400 los votos del total",0.59,0.77,0.51,1.79,1.2,1.68,2.56,0.87,0.64,1.53,1.15,1.04,2,0.72,1.12,0.94,1.4,1.3,1.12,1.32
"Pero si en los mismos canales dijeron, Quien determina el resultado de una eleccion: la prensa o el el colegio electoral/corte ?",0.5,0.98,1.45,0.64,0.65,0.65,1.56,0.7,1.03,0.41,0.77,0.74,0.18,0.58,0.3,0.57,0.17,1.17,0.17,1.09
Deja de llorar. Se riguroso y reconoce que tengo razon: la prensa no hace oficial un nombramiento.,0.69,0.3,0.33,0.39,0.39,1.04,0.9,0.21,0.16,0.56,0.28,0.51,0.82,0.71,0.27,0.66,0.61,0.63,0.47,0.79
"La vieja y confiable ""me concentro en lo que me ofende personalmente en vez de todo el resto del comentario"". No, el resultado oficial es después, pero no sé por qué te pica tanto el hoyo que la prensa gringa esté haciendo lo que siempre hace durante las elecciones: declarar un ganador cuando el resultado es aparente.",1.42,1.08,1.86,1.41,0.99,1.23,3.68,0.65,1.72,1.33,1.15,1.04,1.68,0.54,1.53,0.95,1.7,2.13,0.64,2.17
"La vieja y confiable ""me concentro en lo que me ofende personalmente en vez de todo el resto del comentario"" Es tu culpa por no saber argumentar y estar histerico tirando baits pensando que con eso la haces no sé por qué te pica tanto el hoyo Wow. que argumento mas solido. la cagaste. next! Sigo teniendo la razon. Pero tu moral es la tipica de los interseccionales. Para nada rigurosa.",1.06,0.77,1.68,2.61,1.97,1.53,4.76,1.08,1.56,3.41,1.14,1.38,1.83,1.62,1.67,1.35,1.85,1.92,1.59,4.04
"Es tu culpa por no saber argumentar y estar histerico tirando baits pensando que con eso la haces Buen resumen de ti Ozz. Veo que sigues llorando ad hominem, así que te dejo entre tus sollozos de justicia porque sabes que tienes la razón, ser iluminado por /pol/.",0.86,0.96,1.38,1.48,1,0.97,2.67,0.89,0.64,2.53,1.03,0.71,1.39,1.11,0.86,0.85,2.38,1.3,0.82,3.69
"Nunca lo aceptara porque no es un tema evidencia o de como funciona el sistema de estados unidos, sino que para el Trump es ""basado"" y no puede perder a menos que sea una super-duper conspiración. This is your brain in anti-SJW.",0.63,1.31,1.45,1.7,0.87,1.14,1.95,0.93,1.38,2.24,0.92,0.37,1.96,0.97,1.05,0.71,0.83,1.4,1.37,1.36
"Tu te ríes, pero el hecho que hayan puesto a una super conservadora en la corte suprema con el apoyo cerrado de todos los republicanos. Qué Trump haya transformado al GOP en un culto a su personalidad y que los seniors republicanos no hayan aceptado la derrota. De aquí a enero vamos a ver de que está hecha la institucionalidad gringa.",1.15,1.34,2.41,2.17,1.33,1,3.99,2.14,1.06,2.71,1.26,0.95,2.18,2.17,1.68,1.17,2.54,1.2,1.4,3.56
"los noticiarios realmente podían haber declarado a Biden ganador el miércoles/jueves fácilmente debido al trend obvio de los votos por mail, pe Los noticiarios no son los encargados de dar la confirmacion oficial. Ese es todo el punto. La prensa puede declarar en base a lo evidente, pero no es lo oficial.",1.66,1.5,1.66,1.95,1.55,1.82,3.19,1.19,1.23,2.08,0.63,0.76,2,1.18,0.76,1.46,1.86,1.92,1.75,2.19
"Si hubieran irregularidades serias necesitas demasiadas personas en tu payroll para lograr eso a la escala de 10000 votos o más. ¿Porque necesitas hartas personas pa meter votos por correo? no lo necesitas Los seguidores de Trump hicieron lo mismo en 2016 btw, pero cuando se dieron cuenta que Trump iba ganar ya dejaron esta conversación. Super diferente al contexto de pandemia lleno de votos remotos y con records de numero de votos. no weis. se serio.",1.28,1.36,2.34,1.98,1.76,2.26,3.98,1.72,0.93,2.45,1.14,2.05,2.47,1.25,0.97,1.73,2.6,2.12,2.05,3.19
"El proceso de validación de los votos de correo participan por lo menos 30 personas y de todos los partidos políticos que se van sersiorando del correcto funcionamiento de esto, y eso es para cada lugar donde se cuentan los votos. Además, por la pandemia es exactamente más difícil hacerlo porque todos andan más paranoicos y por eso la revisión de algunos votos tomo más tiempo de lo debido.",1.75,2.28,2.34,3.17,1.76,1.81,3.98,2.15,1.09,3.39,1.28,1.54,2.47,1.6,1.38,1.99,2.14,1.7,2.69,3.46
Se puede saber quien gana sin necesidad de que esten todos los votos contabilizados eso se ha hecho y se hará siempre,0.13,0.16,0.91,0.85,0.22,0.49,1.56,0.46,0.52,0.61,0.15,0.19,0.71,0.77,0.6,0.43,0.66,0.47,0.34,0.54
Se puede saber No es oficial hasta que es oficial. La prensa no es un ente oficial,0.46,0.45,1,0.2,0.2,0.45,0.9,0.43,0.78,0.37,0.28,0.34,0.16,0.53,0.82,0.26,0.61,0.84,0.47,0.26
"No sé puede, es un ejercicio de confianza en el sistema pero no un verdadero cambio de poderes. El día que el colegio elector se junten para votar vas a saber quien ganó. Por mucho que los odie Rudy la tiene clara, los medios no eligen ni declaran al presidente, es solo un voto de confianza",1.45,1.71,1.81,2.07,0.82,1.4,3.48,2.55,1.63,2.44,1.08,0.93,1.49,2.12,0.9,0.77,2.15,1.33,2.05,3.09
"como que no, han habido elecciones que se decide el mismo dia del voto en estados unidos a pesar de que faltan todavia dias por contar los votos",0.83,0.78,0.86,0.81,1.02,0.77,2.04,0.88,0.48,1.55,0.58,1.23,1.35,1.28,0.57,0.95,1.1,0.66,0.65,1.59
Yapo choice desconectate un rato del temita ese si biden ya gano ya Hasta fox news lo dio por ganador a biden,0.3,0.2,0.44,0.26,0.81,0.59,0.94,0.84,0.86,0.25,0.37,0.45,0.43,0,0.9,0.35,0.8,1.17,0.62,0.89
Se levantaron duros los Choices hoy xD,0,0.15,0,0.2,0,0,0.18,0.21,0,0.19,0,0,0,0,0.14,0,0,0.21,0,0.26
No me metía hace casi una semana y uff que están densos los de republica.,0.23,0.3,0.66,0.39,0.59,0,0.36,0.21,0.16,0.94,0.28,0.34,0.33,0.35,0.27,0.26,0.46,0.21,0.47,0.26
"Si CNN lo dice, sure. ""democracia",0,0.18,0.19,0,0,0,0.21,0,0,0,0,0,0,0.21,0.16,0,0,0,0,0
"Ya, y las pruebas de eso donde están?",0,0.15,0.33,0.39,0.59,0.45,0.36,0.21,0.47,0.19,0.28,0.17,0.16,0,0,0.26,0.15,0.42,0.16,0
Crees que no van a llegar a un juicio?,0.25,0,0.35,0,0.2,0,0.58,0.22,0.32,0,0.15,0.18,0.35,0,0.43,0.29,0.32,0.44,0.17,0
Ta too en yutú!!!,0,0,0.17,0.2,0.2,0,0.36,0,0,0.37,0,0,0,0.18,0,0.13,0.15,0,0.16,0.79
A ber pasa el likn,0,0.15,0.17,0.2,0.2,0,0,0,0,0,0,0,0,0.18,0.14,0,0,0,0.16,0.26
En Chile el ganador oficial tampoco es oficial el día de la elección. Es proclamado por los medios también. El fallo del tricel ocurre días después.,0.62,0.32,0.72,0.63,1.07,0.96,1.73,0.92,0.68,1.81,0.76,0.73,0.18,1.14,0.89,0.42,0.49,0.92,0.51,1.89
Sumado eso a que los líderes internacionales también lo están felicitando El de mexico no. el sabe que debe esperar la respuesta oficial,0.46,0.6,1,0.39,0.39,0.3,1.25,0.43,0.16,0.56,0.28,0,0.65,0.18,0.55,0.26,0.91,0,0.31,1.31
Ya pos Choice acepta que Trump perdio.,0.13,0.17,0,0.45,0,0,0.82,0,0.18,0.43,0.16,0,0.56,0,0.31,0.15,0.35,0.25,0.18,0.55
"Quiza perdio, pero la palabra oficial no es de la prensa. Es como que aca la TV este dando ganadores ""oficiales"" antes del servel",0.26,0.68,1.62,0.91,0.41,0.87,2.23,0.69,0.81,1.22,0.46,0,0.37,0.58,0.74,0.15,0.16,0.66,0.68,0.92
No se aburre nunca...,0,0.53,0.58,0,0,0.26,0.31,0,0.29,0.33,0,0,0,0.31,0.24,0,0,0,0.55,0
Hablas como si vivieramos allá.,0.14,0,0.2,0.23,0.24,0.18,0.43,0,0.38,0.45,0,0.2,0,0.42,0.16,0,0.18,0.26,0.19,0.28
