"El tío Bernie lo anunció el 23 de octubre https://www.reddit.com/r/Damnthatsinteresting/comments/jpy4ta/bernie_sanders_predicted_exactly_how_the/ Si Trump no hubiera sido tan transparente en su estrategia, quizas ahora alguien lo estaría pescando, pero ya nadie cree que tenga alguna posibilidad judicial de ganar. Si era 270-268 podía ser, pero Biden está en camino a tener +300 votos.",0.48,1.1,1.2,1.66,1.39,1.43,3.76,1.1,0.95,1.93,0.58,0.53,1.37,1.28,1.13,0.56,1.57,0.65,0.65,3.9
"Pero no vaya a ser Venezuela o Rusia. Ahi áltiro observadores de todo el mundo y las elelecciones claramente están arregladas, a menos que gane el que nos conviene, en cuyo caso, todo legal y miren para otro lado por favor.",0.9,0.34,0.89,1.12,0.61,0.68,1.8,0.91,0.49,1.2,0.76,0.91,1.09,0.95,1.18,1.2,1.14,1.32,0.67,1.5
Ambos partidos tienen representantes en los conteos.,0.12,0,0,0.2,0,0,0.36,0,0,0.37,0,0,0,0.18,0,0,0,0,0.31,0.26
"Tu cachai bro que 300 pies son como 100 metros? Me imagino que te equivocaste al escribir, no creo que sean 100 metros sería dejar a los representantes en una esquina de un edificio alejado de toda mesa",0.71,0.77,1.02,1.2,1.21,0.77,2.39,0.88,0.96,0.96,0.73,0.7,1.01,0.73,0.85,0.94,1.09,1.31,1.13,1.59
"Ya compa busque la info, primero ese número varía de estado en estado algunos son 30ft como en Alabama, los únicos estados con 300ft son: Iowa y Oklahoma los dos estados ya votaron con sus representantes por el partido republicano, tal vez yo estoy equivocado en la info que encontré te dejo link aquí si tienes fuentes avísame por acá o mándame un dm me gusta harto leer de política así que feliz de recibir nueva info 😁",1.74,1.13,2.68,3.15,2.56,1.93,4.82,2.3,0.68,3.63,1.37,0.92,2.99,1.72,1.48,1.27,1.97,3,1.35,3.78
"Los jueces, varios de ellos republicanos, rechazaron las litigaciones por que si habían observadores.",0.12,0.48,0.52,0.21,0.2,0.32,0.38,0.66,0.16,0.19,0,0.18,0.17,0.37,0.28,0.14,0.63,0.43,0.33,0.56
Algún podcast bueno de política o de cine?,0.16,0.41,0.23,0,0,0,0.49,0,0.22,0.26,0,0,0.22,0.49,0.19,0.36,0.63,0,0.65,0.9
De política me recomendaron estos 4 hace un tiempo: La cosa nostra No se habla de política en la mesa Comando Jungle TVM Constituyente,0.5,0.33,0.54,0.21,1.08,0.65,1.17,0.23,0.34,0.81,0.15,0,0.71,0.58,0.15,0.28,0.99,0.47,1.19,1.63
"Yo le mando combinacion clave, radio la clave, toda la semana de 8 a 11 AM,",0.23,0.15,0.17,0.2,0.2,0.15,0.72,0.43,0,0.19,0,0.17,0.16,0.53,0,0.13,0.15,0,0.16,0.52
"De política chilena me gusta Hablemos en off de la radio duna, en general los programas radiales que dan en la mañana son la mano para estar al tanto de lo que pasa en política, y hablemos en off es uno de los mejores imo De política gringa/mundial escucho The daily y Throughline, aunque deben haber varios otros",0.98,1.6,3.01,1.46,1.48,1.27,3.06,2.27,1.84,2.6,0.75,0.91,1.04,1.89,1.61,0.98,2.27,3.88,1.68,2.42
"La otra vez dije que estaba difícil para conocer a alguien en persona y que si lo hago, lo haría en fase 4 porque me daba miedo andar en micro. Estamos en fase 2 y esta semana tuve que movilizarme en micro. Creo que igual podría conocer algún men, total, si no me atrae, no me bajo la mascarilla 😂 así que me animé y bajé Tinder. Espero poder registrarme porque la última vez que lo intenté, no pude jajaja 😖",1.32,1.41,2.04,2.46,3.17,1.88,4.29,1.75,0.79,4.41,1.45,0.7,2.38,1.82,1.69,1.79,2.34,1.29,3.06,3.58
"Consulta seria, que debería tener un men para atraerte??",0.23,0.3,0.5,0.78,0.2,0.45,0.36,0.43,0.47,0.56,0.14,0.17,0.33,0.18,0.14,0.13,0.15,0.42,0,0.26
"Pues si, que cosa física y/o psicológica te son atrayentes? O alguna otra cosa que te atraiga",0.36,0.16,0.18,0.82,0.21,0.31,1.13,0,0.33,0.59,0.15,0,0.69,0.56,0.43,0.28,0.64,0,0.33,1.34
"Físico: principalmente, que tenga linda sonrisa (he caído así 😭😂), que se preocupe de su físico (no un musculin de gimnasio, sino más bien del tipo deportista), que se vista bien y cuide de su higiene. Psicológico: que no tenga vicios, que sea comprensivo y respetuoso. Aaaaah y que sea seguro de sí mismo y sepa lo que quiere. Encuentro que no pido tanto, es lo básico para mi, pero me dicen que soy muy exigente 🤔 Y yo me digo a mi misma ""por eso andan con cualquier saco de pelotas que no las valoran"".",2.23,2.58,2.61,5.13,2.21,2.78,6.36,2.23,2.07,3.72,1.63,1.25,4.04,2.41,3.45,1.87,3.82,3.26,3.13,4.02
"No pides mucho, pero igual son un par de cositas puntuales 😅",0.23,0.45,0.5,0.39,0.39,0,1.07,0.21,0.47,0.37,0,0.34,0.16,0,0.14,0,0.3,0.21,0.47,0.26
Si buscas a alguien que esta desarrollando unos sexys pelos en los hombros y espalda me avisas.,0.24,0.47,0,0,0.79,0.47,0.37,0.22,0,0,0,0.18,0.34,0.55,0.42,0.42,0.47,0,0.16,0.83
Cada vez que leo esta clase de comentarios reúno más motivos para crear una nueva versión del ReddiTinder 2.0,0.13,0.7,0.77,0.91,0.23,0.52,1.46,0.25,0.56,1.09,0.49,0.6,0.95,0.41,0.64,0.15,0.71,0.25,0.73,0.28
La primera versión funcionó? 😅,0.23,0,0,0.39,0.2,0.15,0.18,0.43,0,0,0,0.17,0.16,0,0,0,0,0.21,0.16,0
"Hubieron muchos participantes. Supe también que se formaron un par de encuentros, así que de que tiene efectividad, al parecer si 😯",0.77,0.6,0.66,1.3,0.27,0.4,1.19,1.42,0.65,0,0,0.91,1.09,0.47,0.37,0.35,1.22,0.59,0.21,0.89
Y si me conoces a mi y era,0.13,0,0.19,0.44,0.45,0.17,0.4,0.48,0.18,0.42,0,0,0,0.4,0.15,0.15,0.17,0.49,0.35,0
demas. pa q te vai a andar pelando por tinder si aquí tení pura calidah (?,0.23,0.15,0.33,0.39,0,0.45,0.54,0,0,0.37,0.42,0.17,0.33,0.18,0.41,0.39,0.46,0.42,0,1.05
"Ya que no los puedo ver porque no tienen fotos -sino les enviaría un inbox carepalo-, tendría que crear un post, que publiquen su CV y ahí voy filtrando si me interesa o no jajaja",0.71,0.46,1.01,1.4,1.38,0.77,2.75,1.08,1.72,1.71,0.72,0.69,1.33,0.9,1.11,0.54,1.08,1.06,0.96,1.35
te dai cualqiier color zi. quedate con el locoh noma. más confidente que este man no vai a encontrar,0.23,0.15,0.66,0.59,0.78,0.6,1.07,0.64,0.31,0.19,0.56,0.51,1.14,0.35,0.41,0.52,0.91,0.42,1.1,0.26
Mil veces mejor Tinder que reddit para conocer gente 😂,0.14,0.73,0.2,0.72,0,0.18,0.44,0.52,0.39,0.23,0.52,0,0.4,0.43,0.33,0.16,0.19,0.53,0.38,0.29
Parece que hablas desde la experiencia jajaja,0.12,0.15,0.17,0.2,0.2,0.15,0.18,0.21,0,0.19,0,0,0.33,0,0.14,0,0.15,0,0,0
"Es que siento que por acá se agrandan mucho, en cambio aunque arreglen la foto en Tinder nunca va a ser tan catfish la wea.",0.12,0.45,0.33,0.98,0.39,0.3,0.72,0.43,0.78,1.12,0.28,0.17,0.49,0.71,0.55,0.26,0.61,0.42,0.63,1.31
Encuentro que las mascarillas nos han vuelto más misteriosos y sexys en general jajaja.,0,0.3,0.66,0.2,0.39,0.3,0.36,0,0.16,0.37,0,0.17,0.33,0,0.14,0.13,0.15,0.42,0.31,0.26
CTM SI JAJAJAJAJA literal cuando salgo con mascarilla y me la quito para algo siento como rechazo por la mitad que cubría la mascarilla,0.25,0.64,0.69,0.63,1.4,0.97,0.95,0.22,0.64,1.75,0.59,0.53,0.7,0.18,0.86,0.43,0.63,0.65,0.65,0.57
