content,asertividad,autoconciencia emocional,autoestima,desarrollar y estimular a los demás,empatía,autocontrol emocional,influencia,liderazgo,optimismo,relación social,colaboración y cooperación,comprensión organizativa,conciencia crítica,desarrollo de las relaciones,tolerancia a la frustración,comunicacion asertiva,manejo de conflictos,motivación de logro,percepción y comprensión emocional,violencia
creen que los computadores bajen de precio de aqui a un par de meses más?,0.48,0.32,0.51,0.42,0.4,0.16,0.94,0.22,0.63,0.39,0.15,0.18,0.69,0.18,0.57,0.42,0.47,0.22,0.16,0.84
que saben estos ctmre,0.12,0,0.17,0,0,0,0.18,0,0,0,0,0,0.16,0,0.14,0,0.15,0,0,0.26
"eehh.. nu. O sea igual puede que haya ofertas, pero ofertas de mierda.",0.72,0.19,0.19,0.77,0,0.19,0.89,0.74,0.34,0.22,0.33,0,0.41,0.61,0.32,0.51,0.35,0,0.18,0.34
"Cabros necesito un dato de motel barato en Santiago pa ir con mi mina, que sea decente y puta, planeo ir 9 horas durante el día (no noche) por lo que me es complicado encontrar",0.75,0.33,0.88,1.53,0.4,0.67,2.35,0.45,0.48,0.79,0.3,0.9,1.43,0.56,0.58,0.44,0.8,0.66,0.5,1.17
motel barato motel decente Choose one,0,0,0.17,0,0,0,0,0,0,0,0,0,0,0,0,0,0,0,0.16,0
"con mi mina, que sea decente y puta pero que-",0.16,0.21,0,0.29,0,0,1,0,0,0.23,0.18,0.43,0.91,0,0.17,0.2,0.76,0,0.2,0.39
"Es un cerdo decente, no un puerco",0.35,0.15,0.17,0.2,0,0,0.36,0.43,0.16,0.37,0.42,0.34,0.16,0.35,0.14,0,0.3,0.42,0.16,0
Qué consideras barato?,0,0,0,0,0,0,0,0,0,0.19,0,0,0.33,0,0,0,0.15,0,0,0
"seguramente, pero igual pregunta en /r/vinyl",0.15,0.77,0,0.25,0.26,0.38,0.46,0,0.42,0,0,0.22,0.21,0.46,0.53,0.17,0.2,0.28,0,0.58
"De lo poco que cacho de tocadiscos, creo que eso dependería del tipo de aguja, el estado de la misma, y también del contrapeso",0.58,0.3,0.66,0.78,0.39,0.3,1.07,0.85,0.31,0.75,0.42,0,0.82,0.89,0.82,0.39,1.37,0.63,0.94,1.05
"Cabros que tal Youtube music en comparación a Spotify? Siento que Youtube music tiene mucha más música y no viceversa, incluso eso me hizo pensar que muchas veces plataformas tienen ""contenido exclusivo"" pa premiar al cliente y siento que al menos en Spotify eso nunca sucede",0.5,0.82,1.4,1.08,1.41,1.16,2.33,0.67,0.32,0.99,1.19,0.54,1.77,0.93,1.01,1.02,1.76,0.65,0.83,2.32
"De pana. Lo mejor es no tener más anuncios de mierda en Youtube normal. Además la cuenta la puedes poner en otro celular y que reproduzcan al mismo tiempo. Lo malo es que mi plan de Entel no cubre Youtube como sí Spotify, entonces se me van los datos a la mierda.",1.13,1.29,2.45,1.92,1.74,0.37,4.41,1.31,2.38,1.15,0.52,0.84,1.4,0.87,1.18,1.45,2.06,1.62,1.35,2
IMHO no se porqué contratar servicios pagados para evitar anuncios si existen cosas como vanced o similar,0.26,0.5,0.56,0.65,0.67,0.17,1,0.48,0.71,1.05,0.32,0.19,0.55,0.59,0.15,0.44,0.85,0.72,1.05,0.55
Cómo? Al tener Youtube music tu cuenta de Youtube normal no tiene anuncios? Pensé que solo en vídeos musicales o clasificados como tal,0.25,0.48,0.69,1.48,0.6,0.49,1.72,0.44,0.16,0.78,0.44,0.71,1.05,0.92,0.57,0.57,1.27,1.08,0.33,1.14
"Para eso tienes que contratar youtube premium, no youtube music premium solo (youtube premium viene con music premium incorporado)",1,0.65,0.35,0.43,0.6,1.15,0.39,0.22,0.16,0.79,0.45,0.72,0.35,1.49,0.58,0.72,1.28,0,0.66,1.16
Youtube Music premium solo no existe. Está la versión free y la full que es Youtube Premium,0.64,0.17,0.56,0.44,0.89,0.67,0.6,0,0,0.63,0.16,0.38,0.91,0.2,0.46,0.44,0.85,0.24,0.53,0.27
Me lo vendiste,0,0,0,0,0.2,0,0,0,0,0.19,0,0,0,0,0,0,0,0,0,0
Cual creen que es la mejor teleserie Chilena a nivel guión y argumento?,0.13,0.17,0.19,0.22,0,0.17,0.83,0.49,0.18,0.22,0.16,0.2,0.56,0.2,0.32,0.3,0.53,0.5,0.18,0.28
"Pampa Ilusion fue pulenta por el argumento y escenografía, además de una DiGirólamo trans que se involucra con un hetero-curioso Reyes",0.48,0.78,0.52,1.02,0.82,0.31,1.12,1.11,0.65,1.37,0.74,0.89,1.02,0.74,0.43,0.82,1.27,0.89,0.49,0.8
"El reemplazante por lejos, los dialogos y el argumentos estan bien pensados y llevados a cabo, incluso la interpretación es de lo mejorcito que se ha hecho en Chile, es la unica serie en que he visto que se han acercado mas al arquetipo de flaite, sin ser perfecto eso si. En segundo lugar el señor de la querencia, si bien el guión no es la gran cosa, el argumento es bastante bueno y las actuaciones son buenardas. sobre todo por parte de Milostich",1.6,0.96,2.85,3.13,1.91,1.44,4.6,1.83,1.68,2.6,0.6,1.09,2.62,1.33,1.17,1.26,2.28,2.52,1.68,4.58
"Sin duda el reemplazante es la mejor serie chilena, pero creo que el amigo preguntaba por telenovelas",0.54,0.53,0.2,0.46,0,0.35,1.05,0.25,0.19,0.44,0,0.4,0.58,0.42,0.81,0.46,0.72,0.26,0,0.28
El senador Lindsey Graham ya tiro su guante al bando de qué se deben resolver las alegaciones de fraude.,0.65,0.84,0.9,0.45,0.2,0.17,0.2,0.46,0.49,0.81,0,0.73,1.1,0.38,0.74,0.46,0.98,0.22,0.68,0.3
Ya no soporto los anuncios de Twitch.,0.28,0.37,0.19,0.25,0.21,0,0,0,0.17,0.64,0.16,0,0.2,0.61,0.47,0.17,0.52,0.23,0.18,0.34
anda a weiar a otro lado,0,0.15,0,0,0.2,0,0.18,0,0,0.37,0,0.17,0.16,0,0,0.13,0,0,0,0.52
quedate piola vo,0,0,0,0,0,0,0.18,0,0,0,0,0,0.16,0,0.27,0,0.3,0,0,0.26
Yo ya no soporto a gente quejandose de anuncios en *año actual*,0.46,0.3,0.17,0.2,0.2,0,0.36,0.21,0.16,0.37,0.28,0,0.33,0.35,0.55,0.39,0.61,0.42,0.16,0.26
Yo ya no soporte a gente quejandose de los que se quejan en año actual,0.39,0.34,0.19,0.44,0.23,0.17,1.01,0.48,0.18,0.42,0.48,0,0.74,0.4,0.62,0.3,0.69,0.49,0.18,0.55
"A mí nunca me ha bajado la calidad ni me han aparecido anuncios desde que lo instale hace años atrás, incluso para estos días en dónde han reportado ese problema",0.24,0.47,0.69,1.61,0,0.62,2.03,0.66,0.97,0.77,0.29,0.35,1.18,1.1,0.85,0.14,0.94,0.66,0.65,1.06
Anuncios? limites de calidad?,0.14,0,0,0.24,0.25,0,0,0,0,0.23,0.18,0.21,0,0.22,0.34,0.16,0.19,0.55,0,0
Twitch de alguna forma esta bypasseando el bloqueo de anuncios del y que ademas les bloquea la calidad a muchos usuarios de uBlock (a mi no),0.12,0.45,1,0.59,0.39,0.75,0.9,1.07,0.16,0.75,0.28,0.34,0.82,1.24,0.41,0.66,1.22,0.42,0.79,0.26
"normalmente te diria que le dierai no mas, pero como esta media complicada la cosa en términos de empleo dale una buena pensada.",0.37,0.64,1.21,1.06,0.2,0.49,0.77,0.67,1.11,0.98,0.88,0.89,0.52,0.18,0.86,0.57,0.48,0.87,0.66,0
"jaja. No sé, aún no encuentro bien la crítica correcta pero hay algo detrás de estos animés de fantasía que está mal.. cómo si otro mundo no fuera realmente posible",0.65,1.02,1.32,1.55,1.13,0.68,1.83,1.45,0.54,1.27,0.64,1.35,1.11,1,0.78,0.89,1.38,0.49,0.89,1.66
"Sii, es pulento el juego, yo igual estoy viciado. La dinamica de las peleas cambia un poco respecto a los dark souls, pero de que se puede esquivar se puede esquivar, yo no hago parry a cada rato si no que alterno entre parry, esquivar y saltar y hasta el momento voy super bien, ya llevo 3 jefes y la historia esta buenarda. A este tipo de juegos hay que tenerles paciencia eso si por lo pelúos (las herramientas de la protesis igual apañan caleta contra jefes)",1.61,1.77,2.95,2.34,2,2.61,4.81,1.78,1.75,4.31,1.18,1.42,2.98,3.15,1.58,1.58,3.02,1.3,1.97,3.72
consejo que no cache hasta bien al final del juego: si mantienes el bloqueo activado tu barra de stance se recupera mucho mas rápido.,0.55,0.18,0.19,0.24,0.21,0.37,0.64,0.72,0.5,0.84,0.16,0.57,0.78,0.4,0.46,0,0.86,0.68,0.18,0.98
"La arquitectura tradicional de asia oriental, en este caso tradicional japonesa es otro nivel de belleza 👌🏼",0.41,0.36,0.79,1.39,0.48,0.18,0.85,1.52,0.38,1.11,0.5,0.4,0.39,0.63,0.16,0.16,1.08,1.03,0,1.13
"Entero weno, al final es como un juego de ritmo dónde tienes que saber bloquear en el momento justo para hacer el parry. Tip: desbloquea el mikiri counter si aún no lo haces.",0.85,0.16,0.53,0.83,0.63,0.79,2.47,1.13,0.67,1.39,0.45,0.72,1.21,0.56,0.44,0.14,1.13,0.91,0.67,1.88
Lo tuve que desbloquear para poder matar a un cazador de shinobis que blandía una lanza. Era imposible matarlo sin esa habilidad.,0.36,0.47,0.51,0.2,0.4,0.16,1.67,0.44,0.79,0.77,0.14,0,0.68,0.54,0.28,0.14,0.62,0.43,0.16,1.1
"La caga que está en el Sur con el covid, porqué no tiene primetime en todas las teles?",0.36,0.31,0.17,0.41,0.99,0.16,0.56,0.22,0.32,0.77,0.58,0.35,0.34,0.18,0.56,0.14,0.62,0.86,0.16,0.55
Pq no es Santiago,0,0.15,0.17,0.2,0,0,0.36,0,0.16,0,0,0,0.16,0,0,0,0,0,0.16,0.26
"Podrías descargar Truecaller, que identifica las llamadas dependiendo si algún otro usuario a guardado el número. Por ejemplo si el wn que te llamó se llamaba Camilo Fuentes y alguien lo guardó como Cami Fuentes/Camilo podrías responderle sabiendo esos datos. La app te da la opción de bloquear los números además.",0.25,1.15,0.73,1.92,0.44,0.98,2.55,0.93,1.21,2.46,1.08,0.56,1.79,1.36,0.9,0.57,1.83,0.71,0.86,2.18
"Acaba de salirme en una página que se llama whosenumber.info, qué debería hacer? Edit: La página además dice VTR Chile cuando no tengo el número vinculado para nada con VTR",0.59,0.46,0.84,0.4,0.79,0.15,2.39,0,0.31,1.33,0.86,0.52,1.17,0.36,0.7,0.81,0.93,1.49,0.48,1.62
"Mi número, no había entendido bien tu comentario",0.14,0,0.37,0,0.21,0,0.64,0.24,0.33,0,0.16,0.19,0.59,0,0.31,0.16,0.17,0.23,0,0.33
"No te preocupes, de todos modos tu idea me hizo darme cuenta de que mi número es público de cierta forma, gracias &lt;3",0.72,1.1,1.21,1.42,0.62,0.47,1.49,0.44,0.82,0.98,0.15,0.35,0.68,0.74,0.57,0.96,1.11,0.67,0.66,1.07
"No sale nada más que es de Chile, menos mal",0,0.42,1.16,0,0.29,0,0.25,0,0.23,0.26,0.2,0,0.23,0,0.38,0,0.43,0,0.44,0.3
Para la próxima no respondas y bloquea nomás.. cada reacción de tu parte motiva a buscar una nueva reacción y no hay información útil que puedas obtener en un intercambio con ese tipo de persona.. eso.,1.38,1.14,0.88,1.52,1.21,0.83,1.95,1.35,0.8,1.97,1.04,0.9,1.42,1.68,0.72,0.87,0.96,0.87,0.5,0.87
"Me alteré tanto que respondí porque es primera vez que me pasa y me cagué de susto. Muchas gracias, para la próxima tomaré muy en cuenta lo que dices",0.46,0.75,0.33,1.56,1.37,0.89,1.79,0.43,0.47,0.94,0.56,0.85,1.63,0.53,1.23,0.66,1.52,0.21,1.26,1.05
"Esto es serio, tu número de teléfono se filtró de alguna manera. Puede que se hayan filtrado por hackeo a una página con tus datos, en ese caso cambia la contraseña de tu correo si es que la repites en algún otro sitio e intenta evitar usar la misma contraseña en varios lados, recomiendo un generador de contraseñas tipo bitWarden. También puede que haya sido un operario de una casa comercial con acceso a tus datos o de algún callcenter, en ese caso no sé que se puede hacer.",1.9,3.1,4.12,3.23,3.25,1.69,5.92,3.3,2.42,3.29,2.62,2.11,3.37,2.93,2.55,1.9,4.71,2.85,1.79,2.66
"Chuta, no tenía idea de que podía ser eso, me tincaba que el loco anduvo generando números aleatorios solamente. Me acabo de acostar así que voy a poner algunas contraseñas sin algún generador y mañana ver con mucho más detalle el tema de mi seguridad. Muchísimas gracias, sin ti no me daba cuenta que estaba con problemas de ese estilo :(",0.49,1.44,1.73,2.75,1.4,0.48,3.25,0.89,0.64,2.14,0.59,0.89,2.61,2.03,0.71,1.28,2.06,1.08,1.96,1.7
"Uff es bueno desahogarse, tranqui nomás distraete y olvidalo. Estuvo bien lo que hiciste, hay gente pitiada en mala que no entiende que hay weas que no se hacen.",0.12,0.96,1.24,0.21,0.84,0.8,1.53,0.68,0.84,0.8,0.45,0.18,1.05,0.57,0.73,0.42,1.14,0.46,1.01,0.27
"Gracias, entiendo que hay gente pitiada pero como dices, voy a distraerme no más uwu",0.25,0.32,0.18,0.21,0.63,0.16,0.95,0.45,0.67,0.6,0.45,0.18,0.52,0.57,0.58,0.28,0.32,0.68,0.5,0.27
"Ahora cachando la locura espacial que es el movimiento teleevangelista gringo + que se vieron platas gringas en protestas irlandesas contra el aborto. No me sorprendería tanto que incluso le hagan una que otra donación acá, somos como país más tirao hacia los Palestinos pero quizá nunca está demás meterles plata. (Me saco casquito de aluminio)",0.51,1.65,1.24,1.76,1.62,1.18,2.56,0.45,0.8,2.98,1.05,0.72,1.44,0.56,1.17,0.3,2.26,1.75,1.67,2.36
Lucy Ana Aviles. Look it up. La tipa es dominionista y apoya al peor Kast.,0.25,0.33,0.35,0.44,0.81,0.34,0.4,0.23,0,1,0.3,0.18,0.18,0.76,0.15,0.3,0.65,0.22,0.84,1.19
Tu dices recibe plata de evangelistas?,0.12,0.3,0.33,0.39,0.39,0.15,0.18,0.21,0.31,0.19,0,0.34,0,0.18,0,0.13,0.3,0.21,0.31,0
"Al reves, es del tipo de personas que financia a televangelistas y movimientos ultra conservadores.",0.58,0.3,0.33,0.59,0,0.15,0.72,0.43,0.78,0.75,0.42,0.17,0.49,0.35,0.14,0.13,0.3,0.21,0.16,1.05
Pero si es un filántropa de buen corazón. Financió el Supertanker y despúes dejó de pasarle plata a la Fundación para la Confianza cuando James Hamilton (uno de sus fundadores) criticó a Piñera. Muy comprometida con los niños vulnerados.,0.85,1.26,1.75,1.44,1.04,0.78,1.32,2.02,1.48,0.39,0.89,1.07,0.34,1.3,0.43,0.69,0.96,1.79,0.99,1.87
"Los evangelicos están creciendo a un nivel increible en todo el continente, estoy seguro que en las siguientes decadas van a ser religión mayoritaria en algún país en LA. Entiendo que han hecho aportes considerables, como el apoyo a los presos, a la rehabilitación de drogadictos y a la expansión de ciudades en el sur. Pero no me da mucha confianza el culto total hacía un lider que tienen.",0.83,1.08,2.39,2.01,2.42,1.99,3.68,2.19,1.28,1.73,1.02,0.52,1.84,2.19,1.55,1.48,1.88,2.4,1.45,2.39
"rehabilitación de drogadictos La rehabilitación de drogadictos es básicamente un resultado colateral de la oportunidad de adoctrinar gente cuando es más emocional, económica y socialmente vulnerable. Pero acá en el sur de santiago son básocamente todos los centros que existen. Da como entre pena y asco.",0.46,0.75,1.83,1.76,1.37,1.19,3.4,1.07,0.62,1.87,0.71,0.51,0.33,1.95,1.78,0.39,0.91,2.11,0.79,2.36
"aportes considerables inversiones. Básicamente recursos que dependen totalmente del grupo, se replican solos y que con cada generación dan mejores dividendos",0.59,0.19,0.21,0.25,0.79,0.38,1.15,0.55,0.21,0.48,0.18,0.44,1.89,0.23,0.88,0.84,1.17,0.57,0.61,1.17
A mi preocupa el discurso de evangelistas gringos que dicen que es necesario la existencia de Israel para que inicien los últimos días,0.51,0.33,1.06,1.98,0.81,0.84,1.19,0.68,0.16,1.39,0.15,0.18,1.26,1.13,1.02,0.44,1.13,0.88,1,0.89
plata acá de dónde hacia dónde? O plata de EE.UU. hacia acá?,0.46,0.45,0,0.59,0.39,0.45,0.36,0,0.47,0,0.28,0,0,0,0.14,0.26,0,0.42,0.31,1.05
De usa hacia acá,0.12,0.15,0.33,0,0,0,0.18,0.21,0.16,0,0,0,0.16,0,0,0,0.3,0.42,0,0.26
"De usa hacia acá hay varias fundaciones, organizaciones, conglomerados, alianzas, que tienen símiles en Chile y otro países, y casi siempre donan en fondos para caridad y ONGs relacionadas. Que pasen platas políticas es mas dificil ya que muchas iglesias no tienen personalidad jurídicas",0.94,1.23,1.19,2.19,2,0.91,2.93,0.65,0.8,1.15,0.72,0.52,1.17,0.91,0.84,0.67,1.55,1.73,0.8,2.64
"Para financiar iglesias llega plata, eso te lo puedo asegurar. Ahora, conseguir financiamiento para algo más político tampoco sería complicado ni nada muy tirado de las mechas. Suponiendo que seas conservador y te preocupe mucho un tema específico y tienes los contactos necesarios puedes hablar con ellos y venderles la idea de que algo terrible está pasando en Chile y conseguir fondos y existe la posibilidad de que te resulte.",1.6,1.29,2.13,3.13,2.96,2.39,3.64,1.14,1.68,2.8,1.66,0.91,1.92,1.9,1.76,1.54,3.09,1.6,2.19,4.04
"Creo que soy adicto a mi teléfono. Cada vez que no estoy haciendo nada, veo mi teléfono. A veces cuando no lo ando trayendo me siento raro. Necesito ayuda.",0.23,0,1,0.98,0.39,0.45,2.15,0.64,0.62,1.12,0.56,0.17,1.14,0.71,0.55,0.39,1.22,0.63,0.79,1.05
"Estoy en las mismas, pero no es solo ver el teléfono, sino que me pongo a jugar mientras realizo otras cosas. Tengo que borrar esos juegos 😖",0.66,1.04,1.27,1.63,1.44,0.53,1.45,1.17,0.98,1.02,0.62,0.75,1.5,0.39,0.6,0.62,1,0.89,1.03,0.31
Creo que especialmente en estos tiempos es muy tentador distraerse de la realidad. No digo que este mal la verdad quizás es hasta necesario,0.52,0.51,1.31,0.66,0.22,0.5,1.81,0.96,0.53,1.68,0.63,0,0.92,0.8,0.92,0.15,1.2,0.49,0.18,0.83
"Es que aún así creo que es mucho, porque no puedo estar trabajando en el notebook sin mi celu 😖",0.24,0.47,0.34,0.21,0.4,0.16,1.12,0.44,0.31,1.15,0.43,0.17,1.02,0.54,0.42,0.14,0.47,0.43,0.32,0.28
El mismisimo país que controla la delicuencia con jubilados armados.,0.12,0,0,0.2,0,0,0.36,0.21,0.16,0,0,0,0.65,0.18,0.27,0.13,0.46,0.21,0,0.79
Quisiera aprender ingles,0,0.15,0.17,0,0.39,0.15,0,0,0.31,0.19,0,0,0.16,0,0,0,0.15,0,0.16,0
"Buena, reddit es super bueno para aprender, si ya tienes una base más o menos decente con solo sumergirte en el idioma vas a ver que mejoras un montón super rápido. Si tienes problemas para escuchar ve canales de youtube gringos, los subtitulos automáticos en ingles son bastante buenos y con el tiempo te das cuenta que no los necesitas, ahí puedes pasar a los podcasts igual. Si encuentras una palabra nueva, Wordreference es tu amigo",1.79,2.51,2.78,4.44,2.41,1.61,4.29,2.04,1.92,3.36,1.35,1.83,2.15,3.18,1.8,0.47,2.91,2.35,1.88,2.83
Hay discords de habla inglés-español en los que hay caleta de gente dispuesta a ayudar,0.13,0.17,0.93,0.66,0.67,0,0.6,0.72,0.36,0.42,0.16,0.19,0.55,0.4,0.46,0.29,0.86,0.97,0,0.28
Comparte alguno !,0,0.22,0,0.29,0,0.22,0,0,0.25,0,0.21,0,0,0,0.21,0,0,0,0,0
"Vale! Cuales recomiendas? Vi que habian varios. Yo diria que tengo un ingles alto en reading y listening, tambien puedo tener una conversación fluida. Lo que me falla a mi es la escritura, ahi me pifio caleta..",1.09,0.47,0.52,1.44,1.04,0.94,3.02,1.12,0.66,1.97,0.59,0.36,1.55,1.31,1.01,0.83,1.6,1.35,1.16,2.14
"el Spanish-English Learning Server es super activo, yo siempre estoy ahí",0.46,0.4,0.22,0.52,0,0,0.72,0.57,0.43,0,0.38,0.45,0,0.24,0.37,0.17,0,0.59,0,0
"Esto debe ser lo más importante, el conversaje",0.43,0.19,0.21,0.73,0.25,0.19,0.22,0.27,0.2,0.47,0.18,0.43,0.41,0.22,0,0.49,0.19,0.27,0.39,0.29
"lo es, en cuarentena me he metido mucho a hablar por voice-chat a servers de habla inglesa-española y mi nivel de ingles va por las nubes, mi fluidez, pronunciación y acento también",0.58,0.3,1.33,0.39,0.2,0.3,1.25,0.85,0.62,1.12,0.56,0.34,0.49,0.35,0.41,0.13,0.15,0.63,0.79,0.52
El acento chileno es sexy me lo dice. Pedro Pascal es mi pastor y nada me haya de faltar,0.24,0.32,0.35,0.41,0.83,0.31,0.75,0,0,1.38,0.3,0.18,0.69,0.56,0.29,0.28,0.32,0.22,0.5,0.54
No viste el detalle de que no es el acento en si. Es PEDRO PASCAL,0.12,0.79,0.69,0.42,0.8,0.16,0.94,0.22,0.47,0.19,0.15,0.18,1.03,0.18,0.28,0.42,0.63,0.43,0.65,0.28
"Cállate, déjame soñar Pedro pacas es mi pastor Y nada me hará de faltar.",0.13,0.33,0.36,0.22,0.81,0.34,0.4,0,0.32,1.2,0.15,0,0.36,0.38,0.29,0.15,0.33,0.66,0.67,0.9
"Espero que dkease o choice no hayan formulado esta pregunta, pero aqui va, ustedes creen que Trump tiene un pene pequeño?",0.63,0.49,0.91,0.43,0.43,0.33,1.37,0.7,0.86,1.23,0.46,0.37,0.89,0.39,0.6,0.43,0.83,1.18,0.17,0.27
No se. Pero te gustaría verlo?,0.15,0.19,0.19,0,0,0,0.45,0.25,0.34,0.22,0,0,0,0.21,0.16,0,0,0,0.18,0.35
"Mira, no sé por que pero es la primera ves que pienso en eso.. y darme cuenta hizo que me preguntara por los penes de demasiadas personas. :/",0.12,1.05,0.66,0.78,0.39,0.3,2.68,0.21,0.47,0.75,0.42,0.68,1.3,0.53,0.96,0.52,1.06,0.42,1.26,1.05
Estas calificado como persona non grata de la Tula de Allende,0.35,0.15,0.33,0.2,0,0.3,0.18,0.21,0.31,0.75,0.28,0.17,0,0.71,0.41,0,0.15,0.42,0,0.52
Más interesante sería saber el color. ¿Será como una zanahoria?,0.13,0.33,0.55,0.43,0.44,0.16,0,0,0.35,0.21,0.31,0,0,0.39,0.15,0,0,0.24,0,0.54
"Más interesante que el color sería saber el sabor, sabrá a cheetos?",0.25,0.32,0.72,0.63,0,0.16,0.58,0,0.68,0.2,0,0,0.53,0.38,0.59,0.14,0.16,0.7,0.34,0.54
blanquito y con pelo rubio.,0.15,0,0.2,0.27,0.22,0.42,0.47,0,0,0.45,0.17,0,0.22,0,0.16,0,0.36,0,0.19,0
"Sí, debido a su obesidad.",0,0.18,0.4,0,0,0.18,0,0.26,0.19,0.22,0,0,0,0.42,0.16,0,0.18,0,0,0.28
si yo midiendo metro y medio tengo pene pequeño entonces Trump que mide casi 2 metros debe tener una pierna como pene,0.6,0.31,0.87,1.23,1.03,0.94,1.13,0.45,0.98,1.76,0.44,0.36,0.68,0.93,0.29,0.55,0.48,1.12,0.82,1.6
Así no funciona el pene pero bueno,0.31,0,0.2,0.56,0,0,0.72,0.52,0.52,0.45,0.51,0.41,0.22,0.43,0,0.19,0,0.48,0.19,0.37
Lo dice el tita shico jejeje,0,0.15,0.17,0.2,0.2,0.15,0.18,0,0,0.19,0,0,0.16,0,0,0,0,0,0.31,0.26
"A ver que pasó aquí, ?🤔",0.12,0.15,0,0.39,0,0,0.72,0.21,0,0.19,0.14,0.17,0.49,0.18,0.27,0.13,0.46,0.21,0.16,0.26
"Sí, un poco menos que el promedio",0.13,0.17,0.57,0,0.23,0,0.61,0,0.36,0.21,0.16,0,0.19,0.2,0.16,0,0.52,0.25,0.18,0.28
"Dentro del random semanal, busco alguien que quiera jugar Satisfactory , hacer una base grande desde cero Cualquier cosa me avisan jejej",0.66,0.17,0.38,0.22,0.46,0,1.23,0,0.36,0.64,0.16,0.19,0.56,0.4,0.47,0.75,0.35,0.49,0.36,1.38
"Con todo lo bonito y cool que es The Mandalorian, no les haría daño que los capítulos tuvieran un poquitito más de sustancia. 10 capítulos y 5-6 son puro relleno en que la historia avanza nada. Ni Dragon Ball Z se atrevió a tanto.",0.49,0.8,1.07,1.04,1.27,0.32,2.49,0.23,1.18,0.8,0.76,0,0.7,0.57,1.47,0.14,1.3,0.92,0.67,2.43
"El tema con mando es que el relleno es mas una side quest que episodios botella, y de hecho ayudan al desarrollo del personaje, pensaba lo mismo que tu hasta que cache que simplemente cuentan la historia diferente al resto, quizás estamos acostumbrados a eso tmb",0.72,1.1,1.91,1.02,0.82,0.62,3.36,1.33,1.63,0.98,0.44,0.18,2.04,0.74,1.86,0.41,2.06,1.11,1.15,1.33
"¿La nueva temporada? No la he visto, pero la primera ya era un poco así por su formato episódico.",0.12,0.47,0.52,1.03,1.24,0.47,1.32,0.45,0.66,1.57,0.45,0.36,0.34,0.75,1.01,0.41,0.48,0.45,1.16,1.07
"Si fuera 100% episodico lo entendería, pero hacen el tease de que van a pasar cosas importantes (escena final primera temporada, escena final capítulo anterior) y no pasa nada por un buen rato. Y con tan pocos capítulos no deberían rellenar tanto. Creo que si cortaran el relleno de la primera temporada les quedaría perfecta una película de mas menos dos horas.",1.2,1.25,2.89,1.84,0.99,1.25,3.16,1.75,1.89,1.92,0.72,1.05,1.19,0.73,1.26,0.82,1.09,1.07,1.29,3.85
"Sí, igual debe ser por diseño. Mi impresión es que Disney no se quiere comprometer con lo que es canon en Star Wars, entonces la historia se desarrolla en su mayor parte con aspectos adyacentes de lo que ha sido generalmente el foco principal de SW y ocupa la trama de Baby Yoda para mantener la atención de quienes esperan esa parte más jugosa del universo.",0.93,1.52,1.85,2.38,1.59,1.06,2.36,2.16,1.1,1.52,1.15,1.21,1.82,1.44,1.95,1.6,2.31,1.93,1.43,2.64
"Recomiendan algún cerrito o recorrido para hacer trekking en santiago y/o alrededores? Cualquier cosa con algo de belleza y que no esté toda seca sería genial. Edit: Csm me equivoqué de hilo, me he convertido en lo que juré destruir. Oh, well.",1.23,0.36,0.98,1.16,1.43,0.35,2.76,0.76,0.38,0.89,0.5,0.6,0.77,0.84,0.97,1.55,1.44,1.29,0.93,1.69
El cerro del medio en barnechea está bastante bueno. Hicieron dos caminos para subir y tiene bonita vista.,0.42,0,0.41,0.48,0,0.36,0.44,0.26,0,0.46,0.17,0.21,0.2,0.22,0,0.16,0,0,0.19,1.14
"está bueno el dato, gracias!",0,0,0.3,0,0,0.27,0,0,0,0,0,0,0,0,0,0,0,0,0,0.69
"La Quebrada de Macul ta re piola, hay pozones y harta vegetación.",0.23,0.15,0,0.59,0.39,0.15,0.54,0,0,0.37,0.14,0.17,0.16,0,0.27,0.39,0.46,0.21,0.31,1.05
He ido y siempre la encuentro más seca que la chucha. Por qué lado subes?,0.23,0,0.33,0.39,0.2,0,0.72,0.21,0.16,0.56,0.42,0,0.33,0.35,0.41,0.13,0.46,0.42,0.16,1.31
"Entro por Diagonal Las Torres y voy pegadito al río todo el rato, eventualmente llegai a las pozas y hay una cascada bien bonita. Capaz te ibai hacia el lado norte, como está más lejos del río es re seco.",0.51,0.99,0.73,0.86,1.31,0.98,1.77,0.94,0.69,1.65,0.78,0.94,0.72,0.97,0.9,0.43,1.34,1.89,1.04,3
"Ya todo está seco en esta época xD En el Arrayán tienen cerrado el trekking. Puede ser El Morado? Hasta la lagunita, pero no te puedes bañar.",0.75,0.49,1.05,1.08,1.21,0.83,1.17,1.12,0.48,0.39,0.6,0,0.89,0.37,0.29,0.44,0.64,0.44,0.66,0.58
"No lo cachaba, se ve bonito pero me queda a la csm jaja quizás más adelante, grax",0.26,0.17,0.54,0.46,0.41,0.18,1.23,0.46,0.16,0.61,0.15,0.37,0.37,0.39,0.15,0.15,0.33,0.89,0.85,0
"CORXEA COCINANDO CON LA BOCA, los papas le escondieron todos lo cuchillos de la casa para que no se matara, así que ahora en vez usar cuchillos corta las cosas con los dientes. Es el capítulo especial de supervivencia, ctm hace tiempo que no me reía tanto con alguien cocinando.",0.37,1.13,0.9,1.9,1.07,1.13,2.71,0.92,0.85,2.22,0.61,1.1,1.41,1.72,1.33,0.57,1.97,0.93,1.36,3.24
Viejo el video.,0,0,0,0,0,0,0.36,0,0,0,0,0,0,0,0,0,0,0,0,0.52
quien es? Me cayo pesimo pero no puedo seguir no viendolo,0.35,0.3,0.17,0.39,0.2,0.15,0.72,0,0.16,0.37,0.56,0.34,0.65,0.18,0.41,0.52,0.76,0.21,0.16,0.26
No entiendo cómo todavía no lo echan de la casa.,0.12,0.15,0.33,0,0.39,0.45,0.54,0.21,0.31,0.19,0.28,0.17,0.49,0.18,0.27,0.13,0.15,0.42,0.16,0.26
"estoy escuchando a un wn de 28 años, dar lecciones sobre cómo puede mantenerse por su cuenta gracias a su super inteligencia y que todo es culpa de sus padres. mientras muerde weas y escupe en una olla. :/ Igual entrete",0.87,1.94,1.61,1.05,1.7,0.96,2.51,1.38,1.35,1.61,0.91,0.73,1.4,1.33,0.89,0.99,1.31,1.15,1.35,1.62
El internet es una cosa mágica,0.23,0.15,0.33,0.2,0.2,0,0.18,0.21,0.47,0.37,0.14,0.17,0.33,0,0,0,0.15,0.21,0,0
"y que tus padres te paguen los gastos, también.",0,0.16,0.18,0.65,0.2,0.17,0.39,0.22,0.32,0.59,0.3,0.18,0.18,0.37,0.14,0.44,0.16,0.44,0,0
